title,subtitle,author,article_content
"Escalação do Fluminense: Thiago Silva é dúvida, e Mano tem problemas para enfrentar Cruzeiro","Zagueiro ainda se recupera de um problema no calcanhar e, se for relacionado, irá para o sacrifício. Diogo Barbosa e Germán Cano estão suspensos",Redação do ge,"O Fluminense realizou a sua última atividade antes de enfrentar o Cruzeiro, nesta quinta-feira, no Maracanã, pelo Campeonato Brasileiro, e tem uma grande dúvida: a presença de Thiago Silva. O zagueiro não está confirmado e, se for relacionado, atuará no sacrifício. Além dele, o técnico Mano Menezes tem outros problemas para montar a equipe.
Thiago Silva segue se recuperando da lesão no calcanhar que o tirou do segundo tempo da partida contra o Atlético-MG, na Conmebol Libertadores, e o fez ser poupado diante do Atlético-GO. Vale lembrar que o lateral-esquerdo Diogo Barbosa e o Germán Cano estão suspensos e tendem a ser substituídos por Marcelo e Kauã Elias.
Mano Menezes também pode fazer alterações na lateral-direita e na linha de volantes.


O Fluminense venceu quatro das últimas cinco partidas que disputou contra o Cruzeiro, marcando oito gols e sofrendo apenas três. A única vitória mineira nesse período aconteceu justamente no último jogo, dia 19 de junho deste ano, pelo 1º turno do Brasileirão. William fez os dois gols da vitória por 2 a 0.
Com 27 pontos, o Fluminense vem de eliminação na Libertadores e está há três jogos sem vencer no Brasileiro. O time está na 18ª colocação, com um ponto e um jogo a menos que o Vitória, primeiro clube fora do Z-4.


Assista: tudo sobre o Fluminense no ge, na Globo e no sportv"
Atlético-GO x Fluminense: Cano pega celular e mostra imagem de gol validado pelo VAR,"Resultado mantém Fluminense zona de rebaixamento, na 17ª posição, em situação delicada no Brasileirão",Redação do ge,"O atacante argentino Germán Cano ficou inconformado e protestou de forma incomum contra a validação do gol que decretou a derrota do Fluminense para o Atlético-GO por 1 a 0, neste domingo, em Goiânia. O atacante já havia sido substituído e, junto ao banco de reservas, mostrou ao quarto árbitro Fábio Augusto Santos Sá Junior uma imagem de um celular que, em sua opinião, provaria que o lance foi irregular.
+ Atuações do Fluminense: Fábio se salva e Mano é maior culpado por derrota em Goiânia; dê suas notas
Com o resultado, o Fluminense continua na zona de rebaixamento, na 17ª posição, em situação delicada. Soma apenas 27 pontos.
+ PC Oliveira entende que gol do Atlético-GO contra o Fluminense foi legal
O lance do gol ocorreu aos 42 minutos do segundo tempo. Jean Carlos foi à linha de fundo e perdeu o controle da bola, que rolou para a linha, até que o jogador retomou o domínio e cruzou para a área. A bola resvalou em alguns jogadores do Dragão e sobrou para Janderson chutar para o fundo da rede.
Inicialmente, o assistente Victor Hugo Imazu dos Santos anulou o gol. O lance foi imediatamente analisado pelo VAR, que considerou que a bola não saiu completamente do campo e validou o gol.
Tão logo, jogadores e membros da comissão técnica tricolor tiveram acesso à imagem do lance, por celular, começaram a protestar com veemência junto à arbitragem. Neste momento, Cano tentou fazer com que o quarto árbitro assistisse à jogada, convicto de que a bola saiu. A arbitragem entendeu que a reclamação foi exagerada e expulsou Cano.
+ ✅Clique aqui para seguir o novo canal ge Fluminense no WhatsApp
Na saída de campo, o zagueiro Antonio Carlos criticou a atuação do árbitro Ramon Abatti Abel:
- A gente sabia que depois da eliminação seria um jogo difícil, que teríamos que competir, que brigar, independente do que está rolando no campeonato, sabíamos que seria muito difícil. Tivemos chances, eles também. Fica de lição que temos de colocar a bola para dentro. Vamos continuar batalhando. Não pode acontecer o que aconteceu. O bandeira deu (a saída da bola). Na dúvida, ele tinha que olhar pro VAR. O bandeira deu a saída da bola. Isso é inadmissível. Um erro grotesco desse. O Fluminense é muito grande, a gente sabe o peso dessa camisa. Não vamos desistir. Vamos fazer o fator casa estar junto com a gente.




Assista: tudo sobre o Fluminense no ge, na Globo e no sportv"
"Morre Denílson, o ""rei Zulu"", campeão brasileiro pelo Fluminense em 1970","Sétimo jogador que mais vestiu a camisa do Flu, ex-volante morreu aos 81 anos; no Tricolor, ele foi também foi tetracampeão do Carioca",Redação do ge,"Morreu nesta terça-feira Denílson, apelidado por Nelson Rodrigues de ""Rei Zulu"", aos 81 anos. Ele é o sétimo colocado na lista de jogadores que mais defenderam o Fluminense na história, com 431 jogos.
+ Mário, sobre futuro de Arias no Fluminense: ""Vamos realizar o desejo dele de jogar na Europa""
+ Mário vê ""união válida"" em cobranças da torcida e respalda Mano Menezes no Fluminense
Ex-capitão do Tricolor, o volante sagrou-se campeão brasileiro em 1970 e também foi tetracampeão do Campeonato Carioca (1964, 1969, 1971 e 1973). Pela seleção brasileira, ele disputou a Copa do Mundo de 1966.
A causa oficial da morte não foi divulgada pelo Tricolor. Em agosto deste ano, Denílson venceu uma disputa jurídica contra um plano de saúde, recebendo o direito de ser assistido com o serviço de ""home care"" em meio ao tratamento de um câncer. Nas redes sociais, o Fluminense emitiu uma nota de pesar:
+ Grupo de torcedores vai ao CT do Fluminense e tem reunião com Mano Menezes e diretoria
""Lamentamos profundamente o falecimento de Denílson, o Rei Zulu, que por muitos anos foi capitão do Fluminense. Campeão brasileiro em 1970 e tetracampeão carioca (1964, 1969, 1971 e 1973), Denílson vestiu nossa armadura em 431 oportunidades, foi para a Copa do Mundo de 1966 e se tornou um dos grandes jogadores da história tricolor. Desejamos muita força a todos os familiares e amigos em momento tão difícil.""
O Fluminense é o atual 18º colocado na tabela do Campeonato Brasileiro. O Tricolor tem 27 pontos, um a menos que o Vitória, primeiro clube fora do Z-4. A equipe baiana tem um jogo a mais que o Fluminense, que ainda não disputou a partida da 17ª rodada contra o Athletico-PR.
+ ✅Clique aqui para seguir o novo canal ge Fluminense no WhatsApp




Assista: tudo sobre o Fluminense no ge, na Globo e no sportv"
Campanha do Fluminense é pior do que a de outros grandes que foram rebaixados no Brasileirão; veja lista,"Números após 27 jogos são piores do que os que levaram clubes como Corinthians, Santos, Vasco e Cruzeiro à Série B. Porém, Flu esteve em situação pior em 2008 e 2009 e permaneceu na Série A",Redação do ge,"O Fluminense não está rebaixado no Campeonato Brasileiro, mas precisa ligar o sinal de alerta urgentemente. Isso porque a matemática diz que é preciso reagir imediatamente e ter total atenção na luta pela permanência na Série A. Neste momento, a campanha é pior que a de outros clubes grandes que foram rebaixados na competição de pontos corridos — com 27 jogos disputados. Porém, o passado do Tricolor traz esperança.
O levantamento feito pelo ge inicia a contagem a partir de 2006, quando o torneio passou a ser disputado por 20 clubes. De lá para cá, cinco dos ""grandes rebaixados"" tiveram campanhas superiores a do Fluminense após 27 partidas (Corinthians-2007, Vasco-2013, Cruzeiro-2019, Vasco-2020 e Santos-2023). Com 27 pontos em 27 partidas, o Tricolor está na 18ª colocação.








Curiosamente, o passado do Fluminense traz esperança. O Fluminense nunca foi rebaixado no Campeonato Brasileiro de pontos corridos exatamente por reagir na hora certa e tem dois exemplos a serem seguidos: as arrancadas de 2008 e em 2009. Ambas as campanhas eram piores do que a atual neste mesmo momento do campeonato e o Tricolor ficou na Série A.




O Fluminense é o atual 18º colocado da tabela do Brasileirão, com 27 pontos somados - um a menos que o Vitória, primeiro clube fora do Z-4, que também tem um jogo a mais que o Tricolor. Na próxima rodada, o Flu vai a campo no Maracanã para reencontrar Fernando Diniz, novo técnico do Cruzeiro, em duelo da 29ª rodada do torneio nacional.


Assista: tudo sobre o Fluminense no ge, na Globo e no sportv"
"Ignácio é liberado pelo DM, treina com o elenco e se aproxima de retorno ao Fluminense","Zagueiro está recuperado de uma lesão no menisco do joelho esquerdo, que o fez passar por um processo cirúrgico",Marcello Neves,"Recuperado de uma cirurgia no menisco do joelho esquerdo, Ignácio está muito próximo de retornar ao Fluminense. Após iniciar o trabalho de transição, o zagueiro já está fazendo atividades no campo e voltou a treinar com o elenco no CT Carlos Castilho.
Apesar das boas notícias, o retorno é tratado com cautela — as chances de enfrentar o Cruzeiro, na próxima quinta-feira, pelo Campeonato Brasileiro, são remotas. A utilização depende da avaliação da comissão técnica sobre a sua condição física.
Um dos reforços do Fluminense para a janela de transferência, o zagueiro entrou em campo apenas duas vezes: na derrota para o Vasco por 2 a 0, no dia 10 de agosto, e no empate por 0 a 0 com o Corinthians, no dia 20. Diante do Alvinegro, o zagueiro fazia boa partida, mas deixou o gramado no segundo tempo com dores no joelho.
Desta forma, a única pendência no departamento médico do Fluminense - capitaneado pelo médico Douglas Santos, com ajuda do coordenador de fisioterapia Nilton ""Filé"" Petrone - é Lelê. O atacante sofreu uma ruptura no ligamento cruzado anterior do joelho direito em abril e não sabe se voltará a jogar em 2024.


Assista: tudo sobre o Fluminense no ge, na Globo e no sportv"
Fluminense lança nova camisa em homenagem ao Outubro Rosa,Peça faz parte de parceria com a Federação Brasileira de Instituições Filantrópicas de Apoio à Saúde da Mama,Redação do ge,"O Fluminense lançou nesta terça-feira a nova camisa especial em homenagem ao Outubro Rosa. A peça faz parte de uma parceria com a Femama (Federação Brasileira de Instituições Filantrópicas de Apoio à Saúde da Mama) em prol da conscientização e prevenção do câncer de mama, em que parte da renda será revertida para a causa. O uniforme tem o objetivo de reforçar a importância da realização de exames periódicos a fim de identificar e tratar a doença ainda em sua fase inicial.
- Queremos ampliar cada vez mais o diálogo sobre o câncer de mama, levando informação para diferentes segmentos da sociedade. A Umbro tem sido uma grande parceira neste trabalho, promovendo a conscientização através das camisetas alusivas ao Outubro Rosa e dos conteúdos compartilhados sobre o tema - afirma Dra. Maira Caleffi, mastologista e Presidente Fundadora da FEMAMA.
A camisa desse ano traz tons de rosa mais claros, que carregam suavidade e feminilidade e reforçam o compromisso da Umbro e do Fluminense com a conscientização a respeito da doença.
Com uma longa parceria de quatro anos junto à Femama, a marca produziu a campanha para simbolizar o protagonismo feminino, além de celebrar a força das mulheres, de suas atletas e da equipe que está por trás de cada detalhe da produção.
+ ✅Clique aqui para seguir o novo canal ge Fluminense no WhatsApp
A camisa traz ainda estampa que apresenta leves grafismos, além de uma gola V diferenciada. A nova camisa já pode ser encontrada nas lojas oficiais do Fluminense.




Assista: tudo sobre o Fluminense no ge, na Globo e no sportv"
"Mano Menezes admite baixo rendimento do Fluminense e critica arbitragem: ""Contra regulamento""","""A gente tem uma imagem clara que a bola saiu"", considera treinador",Bárbara Mendonça,"A derrota por 1 a 0 para o lanterna Atlético-GO jogou um banho de água fria no objetivo do Fluminense de se ver fora da zona de rebaixamento. A equipe carioca não conseguiu encaixar seu jogo, errou muitas e ficou longe de uma vitória. Para o técnico Mano Menezes, faltou à sua equipe, neste domingo, postura e organização demonstradas em jogos anteriores.
- A única coisa em que se baseia no futebol é produção. Se a gente jogar nos próximos jogos como fez nos 15 primeiros minutos, como teve postura na segunda parte do jogo, mais organizada, a gente volta a fazer jogos parelhos e volta a pontuar. Se a gente joga como nos 30 minutos finais do segundo tempo, a gente não vai a lugar nenhum. Porque a gente voltou a se distanciar como equipe, ficou um grupo lá trás e um na frente. Perdemos o meio, todas as bolas que caíram no meio, tomamos ataque. As questões são muito claras: tem que produzir para merecer - considerou Mano.
+ Cano pega celular e mostra imagem de gol validado pelo VAR
+ Atuações: Fábio se salva e Mano é maior culpado por derrota em Goiânia; dê suas notas
Com o resultado, o Fluminense fica em situação delicada na 17ª posição, com 27 pontos.
Em dado momento do jogo, Mano Menezes foi hostilizado por torcedores do Atlético-GO que o provocavam com gritos de ""segunda divisão"". Na transmissão do Premiere, o repórter Rafael Sebba afirmou que o técnico respondeu de forma bem humorada gesticulando para os torcedores como se dissesse: ""vamos cair eu e você"", uma vez que o time da casa é lanterna da competição. Questionado sobre esse momento, o técnico negou que tenha feito menção a uma possível queda do Fluminense.
- Absolutamente não foi nada disso. A gente já tem problema para resolver. Não tem nada disso. Acreditamos que vamos sair dessa situação.
Apesar de reconhecer o jogo ruim de sua equipe, ele considera que o gol do Atlético-GO foi irregular. O lance do gol ocorreu aos 42 minutos do segundo tempo. Jean Carlos foi à linha de fundo e perdeu o controle da bola, que rolou para a linha, até que o jogador retomou o domínio e cruzou para a área. A bola resvalou em alguns jogadores do Dragão e sobrou para Janderson chutar para o fundo da rede.
Inicialmente, o assistente Victor Hugo Imazu dos Santos anulou o gol. O lance foi imediatamente analisado pelo VAR, que considerou que a bola não saiu completamente do campo e validou o gol.
- A gente tem uma imagem clara que a bola saiu. Isso a gente foi mostrar. Por isso Cano foi expulso, porque levou o aparelho mostrando a imagem e o quarto árbitro disse que é contra o regulamento. Mas dar gol com bola fora também é contra o regulamento.


Rendimento da equipe
- A gente tende a achar que o futebol se resume a ter mais vontade ou ter menos vontade. Não acredito que nenhum jogador entre em campo sem vontade de buscar o resultado. Mas a maneira que você vai buscar é muito importante. Você tocou num ponto que eu sempre deixo claro. Quando você não faz a sua parte como equipe, os outros fazem, seja em que lugar da tabela estiverem, seja com quantos milhões você montou seu elenco, seja a sua capacidade de investimento. No Brasil é assim. Se o primeiro colocado não fizer bem o seu jogo, o último ganha dele. A gente precisa voltar a fazer bem o jogo que a gente quer fazer. Estamos disputando menos o jogo quando ele fica ruim. Quando fica bom você tem volume e ai escolhe como quer construir o seu jogo. Nosso momento está sendo quando o jogo está ruim, quando temos menos a bola porque estamos cometendo erros que não podemos cometer. Isso que precisamos resolver. Falamos sobre isso no intervalo, falei que o final do primeiro tempo foi vergonhoso para uma equipe da nossa qualidade. Não podemos apresentar isso para o nosso torcedor. Temos que ser uma equipe mais próxima da que foi no segundo tempo, organizada, que procurou com mais lucidez encontrar as chances.
Chances perdidas
- Por isso o Fluminense está nessa situação. Se não tivesse perdido o jogo em casa já estaria. Não adianta falar sobre outros jogos, não acho correto. Não foi um jogo para perder também. Tivemos oportunidades no primeiro, nos 15, Keno cabeceou para fora. No segundo tempo, teve lance com Cano, Serna que poderia ter rolado para o Cano. Era um jogo para outro resultado. Mas também tem que ser maduro nessas horas.O nosso adversário joga numa outra circunstância. A gente trabalha para ganhar, mas tem momento que a maturidade exige que não cometa erros graves para não tomar gol no final.
+ ✅Clique aqui para seguir o novo canal ge Fluminense no WhatsApp




Assista: tudo sobre o Fluminense no ge, na Globo e no sportv"
"Três derrotas, dez chutes no gol: baixa ofensividade do Fluminense liga alerta no Brasileirão","Tricolor teve menos de cinco chutes no alvo em derrota para o Atlético-GO, a primeira de 12 ""finais"" na luta contra o Z-4; tropeço em Goiânia foi novamente sacramentado por gol na reta final",Redação do ge,"Os problemas no ataque do Fluminense voltaram a acontecer na derrota por 1 a 0 para o Atlético-GO, neste domingo, pela 28ª rodada do Campeonato Brasileiro. O Tricolor chegou ao terceiro tropeço consecutivo no torneio com uma deficiência em destaque: o baixo aproveitamento do setor ofensivo.
+ ✅Clique aqui para seguir o novo canal ge Fluminense no WhatsApp
Somados os últimos três jogos do torneio nacional, contra Juventude, Botafogo e Atlético-GO, o Fluminense soma apenas dez finalizações no alvo. Os dados são da ferramenta de scout da TV Globo. De todas as partidas, a de maior presença ofensiva tricolor foi o clássico carioca, com seis chutes a gol.
Contra o Juventude, o único chute do Fluminense no alvo foi o gol de Arias, antes da virada que sacramentou a derrota por 2 a 1. Neste domingo, diante do Atlético-GO, o Tricolor conseguiu apenas três finalizações no gol de Ronaldo.
+ Análise: discussão sobre gol do Atlético-GO não pode mascarar incompetência do Fluminense
No Antônio Accioly, o técnico Mano Menezes escalou o time com um trio de ataque modificado: no lugar dos titulares Serna e Kauã Elias, entraram Keno e Cano para compor o setor com Arias. As trocas acabaram acontecendo no decorrer do jogo.
+ VAR aponta bola na linha em gol do Atlético-GO contra o Fluminense; veja análise
Em entrevista coletiva, o treinador do Tricolor lamentou as chances desperdiçadas na derrota para o Atlético-GO. O tropeço foi o sétimo do Fluminense no Brasileirão com gols sofridos após os 35 minutos do segundo tempo.
— Tivemos oportunidades no primeiro tempo, Keno entrou sozinho e cabeceou para fora. Tivemos no segundo tempo uma bola do Cano que o zagueiro salta e salva. Outra em que o Serna faz uma jogada lindíssima, era só rolar pro Cano fazer o gol, mas fez uma escolha errada. Já era um jogo, naquele momento, para outro resultado. Mas também temos que ser maduros nessas horas. O nosso adversário joga numa outra circunstância. Trabalhamos para ganhar, mas tem momento que a maturidade exige que não cometamos erros graves para não tomar gol no final. Custa mais caro ainda na situação que está se colocando.
+ Mano Menezes admite baixo rendimento do Fluminense e critica arbitragem: ""Contra regulamento""
+ Atlético-GO x Fluminense: Cano pega celular, mostra imagem de gol validado e é expulso
O Fluminense é o atual 18º colocado da tabela do Brasileirão, com 27 pontos somados - um a menos que o Vitória, primeiro clube fora do Z-4, que também tem um jogo a mais que o Tricolor. Na próxima rodada, o Flu vai a campo no Maracanã para reencontrar Fernando Diniz, novo técnico do Cruzeiro, em duelo da 29ª rodada do torneio nacional.




Assista: tudo sobre o Fluminense no ge, na Globo e no sportv"
"Em 2009, Fluminense iniciou arrancada para escapar do rebaixamento ao vencer o Cruzeiro",Vitória de virada com gols de Fred se tornou emblemática para evitar a queda naquele ano,"Bárbara Mendonça, Gustavo Garcia e Marcello Neves","Quinze anos se passaram desde um Fluminense x Cruzeiro que se tornou histórico para os tricolores. Em 2009, contrariando os matemáticos, o Flu escapou do rebaixamento no Brasileirão com uma arrancada nos últimos jogos após o time alcançar 98% de risco de rebaixamento durante o Brasileirão daquele ano. Nesta quinta-feira, as duas equipes se reencontram, com o Tricolor novamente precisando da vitória para seguir firme na busca para permanecer na Série A.
Em 2009, o Fluminense passou boa parte do Brasileirão na zona do rebaixamento, igual em 2024. Naquele ano também chegou a ser o lanterna da competição. Mas se salvou graças a uma arrancada nos últimos 11 jogos.
+ ✅Clique aqui para seguir o novo canal ge Fluminense no WhatsApp
A partida contra o Cruzeiro aconteceu no dia 1 de novembro daquele ano e foi válida pela 33ª rodada do Campeonato Brasileiro. Ela não foi a primeira da sequência de 11 jogos, mas acabou se tornando emblemática por ter sido de virada e por ter iniciado uma sequência de triunfos da equipe, que culminaria em uma fuga histórica do rebaixamento e no título do Brasileirão no ano seguinte.
Brigando pelo G-4 na ocasião, a vitória cruzeirense parecia certa após o primeiro tempo, em que os mineiros abriram 2 a 0 no placar com direito a pênalti perdido - sobre o até então lanterna da competição. Foi aí que entrou em cena a precisão de Cuca nas alterações.
O técnico modificou a forma de o time jogar e deu certo. Ele tirou Diguinho e Equi González para colocar Digão e Tartá. A mudança no esquema do 4-4-2 para o 3-5-2 surtiu efeito imediato. Em 25 minutos saíram os três gols que retiraram o time da última colocação.
Revelado no América-MG, mas lançado ao estrelato no Cruzeiro, Fred reencontrou o ex-clube e fez dois gols. Por respeito, ele não externou a emoção que impediu seu ex-clube de chegar ao G-4. Mas foi importante na vitória de virada do Flu por 3 a 2 - o gol tricolor que abriu caminho para a vitória foi marcado por Gum.


Com 11 jogos pela frente até o fim da competição, o Fluminense precisará de pelo menos seis vitórias para alcançar os 45 pontos, que historicamente salva as equipes nos pontos corridos de rebaixamento.
Com 27 pontos, o Flu precisa de seis vitórias para somar os 18 pontos que fariam a equipe alcançar os 45 pontos. A sequência do time até o fim da competição prevê exatamente seis confrontos no Maracanã, o primeiro deles contra o Cruzeiro, nesta quinta-feira.




Com 27 pontos, o Fluminense vem de eliminação na Libertadores e está há três jogos sem vencer no Brasileiro. O time está na 18ª colocação, com um ponto e um jogo a menos que o Vitória, primeiro clube fora do Z-4. A partida contra o Cruzeiro acontece nesta quinta-feira, às 21h30, no Maracanã, pela 29ª rodada. O sportv e o Premire transmitem a partida. O ge acompanha em tempo real.




Assista: tudo sobre o Fluminense no ge, na Globo e no sportv"
Saiu ou não? PC Oliveira entende que gol do Atlético-GO contra o Fluminense foi legal,Janderson finalizou lance após cruzamento de Jean Carlos,Redação do ge,"O comentarista de arbitragem PC Oliveira entendeu que o gol do Atlético-GO contra o Fluminense foi legal. Ao avaliar o lance no Troca de Passes, o ex-árbitro disse que a bola não saiu pela linha de fundo no lance que terminou com a finalização de Janderson. Em Goiânia, neste domingo, o Dragão venceu o Tricolor por 1 a 0.
- É uma jogada extremamente difícil. O VAR vai analisar todas as imagens, e a decisão de campo só será modificada se houver uma imagem conclusiva. A primeira imagem é de uma câmera que não fica exatamente na linha de fundo. Olhando essa imagem, parece que ela saiu. A outra imagem, a que o VAR toma a decisão, é uma imagem exclusiva. Essa câmera, para mim conclusiva, mostra que não saiu. Parte da bola está na linha e, portanto, o gol é legal - afirmou PC Oliveira.
+ Cano pega celular e mostra imagem de gol validado pelo VAR
O lance do gol ocorreu aos 42 minutos do segundo tempo. Jean Carlos foi à linha de fundo e perdeu o controle da bola, que rolou para a linha, até que o jogador retomou o domínio e cruzou para a área. A bola resvalou em alguns jogadores do Dragão e sobrou para Janderson chutar para o fundo da rede.
Inicialmente, o assistente Victor Hugo Imazu dos Santos anulou o gol. O lance foi imediatamente analisado pelo VAR, comandando por Pablo Ramon Goncalves Pinheiro, que considerou que a bola não saiu completamente do campo. O árbitro Ramon Abatti Abel, então, validou o gol.
+ ✅Clique aqui para seguir o novo canal ge Fluminense no WhatsApp
Com a derrota, o Tricolor continuou com 27 pontos na 18º posição. O Atlético-GO subiu a 21 pontos, mas ainda continua na lanterna do Brasileirão.




Assista: tudo sobre o Fluminense no ge, na Globo e no sportv"
