title,subtitle,author,article_content
VAR aponta bola na linha em gol do Atlético-GO contra o Fluminense; veja análise,CBF divulgou vídeos da análise do VAR na noite deste domingo; Dragão também teve gol anulado no primeiro tempo por impedimento,Redação do ge,"A Confederação Brasileira de Futebol (CBF) divulgou as análises do VAR em lances de Atlético-GO 1 x 0 Fluminense, neste domingo, pelo Brasileirão. Houve dúvidas sobre uma possível saída da bola pela linha de fundo no gol de Janderson, mas Pablo Ramon Gonçalves Pinheiro (VAR-FIFA/RN) confirmou ao árbitro Ramon Abatti Abel que a bola permaneceu sobre a linha - e o lance, portanto, foi válido. Foi uma decisão factual, sem necessidade de revisão adicional à beira do gramado.
— A bola não saiu. Confirme o gol. (Decisão) factual, a bola não sai. Não houve falta (entre Derek e Bernal). Os dois saltam de costas e têm um contato lateral.
O lance do gol ocorreu aos 42 minutos do segundo tempo. Jean Carlos foi à linha de fundo e perdeu o controle da bola, que rolou para a linha, até que o jogador retomou o domínio e cruzou para a área. A bola resvalou em alguns jogadores do Dragão e sobrou para Janderson chutar para o fundo da rede.
Inicialmente, o assistente Victor Hugo Imazu dos Santos anulou o gol. O lance foi imediatamente analisado pelo VAR, que considerou que a bola não saiu completamente do campo. O árbitro então validou o gol.
+ Mano Menezes admite baixo rendimento do Fluminense e critica arbitragem: ""Contra regulamento""
Antes da divulgação dos áudios do VAR, o comentarista de arbitragem PC Oliveira já havia reforçado a legalidade do lance:
- É uma jogada extremamente difícil. O VAR vai analisar todas as imagens, e a decisão de campo só será modificada se houver uma imagem conclusiva. A primeira imagem é de uma câmera que não fica exatamente na linha de fundo. Olhando essa imagem, parece que ela saiu. A outra imagem, a que o VAR toma a decisão, é uma imagem exclusiva. Essa câmera, para mim conclusiva, mostra que não saiu. Parte da bola está na linha e, portanto, o gol é legal - afirmou PC Oliveira.
O VAR também analisou um gol de Alix Vinicius, ainda no primeiro tempo de Atlético-GO x Fluminense. O lance acabou anulado por impedimento de Baralhas.
O Atlético-GO é o atual lanterna do Campeonato Brasileiro e chegou a 21 pontos com o triunfo deste domingo. O Fluminense, por sua vez, ocupa a 18ª posição com 27 pontos e três derrotas consecutivas.
+ ✅Clique aqui para seguir o novo canal ge Fluminense no WhatsApp




Assista: tudo sobre o Fluminense no ge, na Globo e no sportv"
Fluminense tem duas baixas e três dúvidas para enfrentar o Cruzeiro,"Suspenso contra o Atlético-GO, Felipe Melo volta a ficar à disposição de Mano Menezes",Redação do ge,"O Fluminense tem duas baixas confirmadas e três dúvidas para enfrentar o Cruzeiro nesta quinta-feira, pelo Campeonato Brasileiro. Suspensos, Germán Cano e Diogo Barbosa estão fora da partida - Kauã Elias e Gabriel Fuentes devem começar jogando.
Além deles, Thiago Silva, Ignácio e Marcelo seguem como dúvidas. Felipe Melo volta a ficar à disposição após ficar de fora contra o Atlético-GO pelo terceiro amarelo.
Cano tomou o cartão vermelho no banco de reservas na derrota para o Atlético-GO ao mostrar o celular para a arbitragem para tentar argumentar que a bola saiu no lance do gol do adversário. Diogo Barbosa estava pendurado e recebeu o amarelo.
Thiago Silva, que jogou contra o Atlético-MG pela Conmebol Libertadores sem estar 100%, foi preservado do jogo contra o Atlético-GO e segue em tratamento no calcanhar do pé esquerdo - ele não presença confirmada.
Assim como Marcelo, que não viajou por sentir dores na panturrilha esquerda. Ignácio, que está treinando com o elenco após passar por uma artroscopia no joelho esquerdo, não tem presença confirmada.
O técnico Mano Menezes ainda tem o treino desta quarta-feira para definir o time que irá enfrentar o Cruzeiro, em jogo que marcará o reencontro com o técnico Fernando Diniz.
+ ✅Clique aqui para seguir o novo canal ge Fluminense no WhatsApp
Com 27 pontos, o Fluminense vem de eliminação na Libertadores e três jogos sem vencer no Brasileiro. O time está na 18ª colocação, com um ponto e um jogo a menos que o Vitória, primeiro time fora do Z-4.




Assista: tudo sobre o Fluminense no ge, na Globo e no sportv"
