title,subtitle,author,article_content
Escudo do Palmeiras: como surgiu e a história do símbolo,Escudo palmeirense remete ao passado italiano do clube e sofreu algumas mudanças ao longo dos anos,"Luiz Eduardo Porto, para o ge","O escudo do Palmeiras possui um longo histórico de mudanças até o seu formato atual. O emblema é marcado por referências às origens italianas do clube, que no passado, era chamado de Palestra Itália; conheça a história.
+ Siga o ge Palmeiras no WhatsApp


O primeiro escudo do Palmeiras é datado de 1914, ano de fundação do Alviverde. O símbolo tinha o formato circular, semelhante ao atual, mas era vermelho na circunferência maior e branco na parte interna, com a inscrições ""Palestra Itália"" em amarelo. Dentro do círculo branco, havia o contorno da Cruz de Savoia, com as iniciais ""PI"".


A partir de 1915, o então Palestra Itália começou a utilizar distintivos com suas iniciais. As letras arcaicas ""P"" e ""I"" estampavam o lado esquerdo do uniforme palestrino e o escudo foi utilizado no primeiro jogo do clube (Palestra Itália 2 x 0 Savoia, em Votorantim, no dia 24 de janeiro de 1915).
+ Hino do Palmeiras: veja letra, origem e história da música
No ano seguinte, em 1916, a diretoria promoveu uma nova alteração no emblema. O Palestra começou a jogar com a Cruz de Savoia como escudo. O brasão, símbolo da Casa Real Italiana, fazia referência às origens do clube, fundado por imigrantes italianos. A equipe disputou sua primeira partida oficial com este escudo, no empate por 1 a 1 com o Mackenzie, no dia 13 de maio de 1916.
De 1917 em diante, o Palestra Itália utilizava variações das letras arcaicas de suas iniciais como escudo. As mudanças mais significativas aconteceram no emblema que circundava as inscrições; de início, as letras ficavam dentro do formato da Cruz de Savoia, mas posteriormente eram contornadas por um círculo.


Em 1942, o clube teve de alterar seu nome por conta da Segunda Guerra Mundial. A Itália estava presente no ""Eixo"", ao lado da Alemanha e do Japão. O Brasil fazia parte do grupo dos ""Aliados"", ao lado de Estados Unidos, Inglaterra, França e União Soviética. Neste ano, o Palestra foi obrigado a mudar seu nome para Sociedade Esportiva Palmeiras.
+ Veja outras notícias do Palmeiras
Com a mudança na nomenclatura institucional, o Alviverde também alterou seu escudo. Com um círculo verde com a inscrição da letra ""P"" em branco, o Palmeiras iniciava uma nova era de sua história.
Em 1959, o emblema passou por grandes mudanças. O formato circular verde foi mantido, mas uma circunferência branca menor continha a silhueta da Cruz de Savoia novamente, com a letra ""P"" e 26 linhas, que remetem ao dia de fundação do clube. Na parte verde, oito estrelas fazem referência ao mês de agosto, período do nascimento do Verdão, com a inscrição ""Palmeiras"". O escudo é utilizado pelo clube desde então.
Conforme descrito no estatuto do clube, o Palmeiras possui cinco símbolos oficiais: brasão, escudo, flâmula, galhardete e bandeira. O distintivo, assim como suas variações, é descrito com detalhes no documento oficial.
- Gravam-se dois aros brancos concêntricos e circunjacentes; dentro dos quadrantes inferiores, em caracteres brancos, gótico-germânicos equidistantes do aro interno, escreve-se: “PALMEIRAS”; no interior de tais círculos, há outros dois menores, um de cor branca e outro de cor verde, que alcançam mais os quadrantes superiores, à volta de um campo branco nos quais se salienta um escudo suíço, de cor verde, com orla alvi-esmeraldina em cujo frontispício se desenha um “P” maiúsculo, de forma especial, já sancionada pelo uso; entre os aros maiores e os menores, em cada quadrante superior, há quatro estrelas brancas, que evocam o mês de fundação da SEP - descreve o estatuto palmeirense.
🎧 Ouça o podcast ge Palmeiras🎧
+ Assista a tudo do Palmeiras na Globo, sportv e ge"
"""Eles perderam tudo"": como joia do Palmeiras superou enchente para viver sonho de campeão","Decisivo com dois gols na final do Brasileiro Sub-20, Rafael Coutinho recebeu ajuda do clube em tragédia com as chuvas no interior da Bahia e sonha com vaga no profissional: ""Mostrar quem sou""",Camila Alves,"Era pandemia da Covid-19, em dezembro de 2021, quando a cidade de Itabuna, no interior da Bahia, choveu por 17 horas seguidas, alagando bairros e deixando 3.500 famílias desabrigadas na maior enchente de sua história. Entre elas, a de Rafael Coutinho, meia do Palmeiras, agora aos 18 anos de idade.
– Eles perderam tudo. A casa era bem próxima ao rio, humilde, e não tinha colchão, não tinha nada – conta o coordenador da base, João Paulo Sampaio, que viu de perto a história.
+ Abel e elenco profissional vão ao Allianz Parque
Três anos depois, com o suporte do clube, Coutinho atravessou um dos momentos mais difíceis de sua vida para tornar-se campeão brasileiro Sub-20, com dois gols na final, contra o Cruzeiro, dedicados à namorada e à mãe, Anaildes Carvalho Barbosa.


A namorada esteve nas arquibancadas. A mãe, vivendo em Itabuna, não pôde estar na final.
Mais notícias do Palmeiras:
+ Dudu se declara à torcida após vitória
+ Veja quem ficar de olho no time sub-20
Coutinho é de poucas palavras. Usa voz baixa e pouco compartilha da própria jornada. Só que sua história virou parte também da vida nas categorias de base do Verdão. Ele estava no Sub-14 no ano da enchente em Itabuna, recebia apenas uma ajuda de custo e por isso, quando soube da tragédia, o coordenador João Paulo reuniu todas as comissões técnicas da base para uma vídeo chamada.
– Ele disse: A gente precisa ajudar um menino – conta o técnico, campeão com o Sub-20, Lucas Andrade.
– Todo o clube se mobilizou, cada um fez a doação que podia, e hoje a gente tem esse atleta com tanta identificação, né? Me arrepia porque essa história é talvez uma das mais incríveis que a gente tem – confessa o treinador, apontando os pelos arrepiados no braço.
Foi com o auxílio de treinadores, auxiliares e atletas do profissional, portanto, que Coutinho e a família se reergueu. Encontrado durante a pandemia, o meio-campista chegou ao Palmeiras através de um observador do clube, que o viu jogando pelo Grapiuna, na segunda divisão da Bahia, e o levou para uma avaliação. Terminou ficando.
Ao longo dos anos, fez parte da geração do bilhão ao lado de Estêvão, Endrick, Luis Guilherme, Vitor Reis, acumulando títulos no juvenil, ainda que mais discreto que os companheiros - logo cedo alçados ao profissional.
– O Coutinho está comendo pelas beiradas. Aparece sempre nos jogos finais, mas é mais discreto, chama menos atenção, mas também está amadurecendo no tempo certo – avalia João Paulo, com um sorriso no rosto.
Ele mudou de segundo volante para camisa 5 e foi o único do Palmeiras a atuar em todos os jogos do Brasileiro Sub-20 na temporada. É visto como um atleta de talento, mobilidade, versatilidade, ambidestro e com capacidade de fazer gols de cabeça - mesmo que mais baixo do que os normalmente considerados.
– Ele poderia ser o 10 do time, porque entra na área, faz gol. E o principal é que é muito trabalhador, sério, dedicado, profissional, e acho que isso vai fazer com que ele seja sempre visto. O ambiente que o Abel oferece é um onde esses são os valores que ele espera e o Coutinho tem todos eles - diz o treinador, orgulhoso.
E depois de três anos colecionando títulos, com mais dois a vivenciar na base antes de atingir o limite de idade, ser visto é o que faz Coutinho sonhar.


+ Siga o ge Palmeiras no WhatsApp
+ Veja mais notícias do Palmeiras
🎧 Ouça o podcast ge Palmeiras🎧
+ Assista a tudo do Palmeiras na Globo, sportv e ge"
Piquerez e Estêvão vão a campo em trabalho reforçado por Dudu na folga do Palmeiras,Atividade realizada na manhã desta segunda-feira faz parte da recuperação da dupla de suas lesões e eles ainda não estão liberados para atuar. Mayke já está em fase de transição,Thiago Ferri,"O elenco do Palmeiras recebeu folga nesta segunda-feira, mas os jogadores em tratamento de lesão foram para a Academia de Futebol dar sequência ao tratamento. Dudu também esteve no CT para trabalhar, apesar do dia livre.
+ Siga o ge Palmeiras no WhatsApp
Piquerez, Estêvão, Mayke e Michel posaram para uma foto com o camisa 7 ao fim do trabalho. O atacante publicou o registro nas redes sociais, brincando que venceu os garotos da base na atividade.
Mais notícias do Palmeiras:
+ Dudu se declara à torcida após vitória
+ Veja quem ficar de olho no time sub-20
Embora Piquerez e Estêvão tenham calçado chuteira e estivessem em campo, eles ainda não estão liberados para atuar, nem começaram a transição entre a parte física e técnica.
O lateral-esquerdo passou por cirurgia no joelho em julho e nutre a expectativa de voltar a atuar ainda em 2024, apesar do risco de só ter condições de jogo em 2025.
Já o camisa 41 teve diagnosticada lesão na coxa há duas semanas e desde então está em tratamento. O Palmeiras trabalha para que o atacante fique fora ao todo por no máximo um mês. A princípio, ele não deve atuar contra o Bragantino, no próximo sábado.
Mayke já está em estágio mais avançado e começou na semana passada a transição entre a parte física e técnica, após lesão na panturrilha. O lateral-direito, contudo, ainda não trabalhou com o restante do elenco, o que pode acontecer nesta semana.
Michel, cria da base alviverde, faz parte do elenco profissional, mas tem lidado com problemas físicos e por isso não tem participado das atividades comandadas por Abel Ferreira.
Além deles, os outros desfalques por problema físico no Palmeiras são: Marcelo Lomba (em transição após pubalgia), Marcos Rocha (dores na coxa direita) e Bruno Rodrigues (cirurgia no joelho esquerdo).
+ Veja mais notícias do Palmeiras
🎧 Ouça o podcast ge Palmeiras🎧
+ Assista a tudo do Palmeiras na Globo, sportv e ge"
Palmeiras tem campanha quase idêntica às de títulos recentes no Brasileirão; compare e simule,Verdão diminui vantagem para o Botafogo pela briga pelo tricampeonato inédito; veja desempenho após 28 rodadas nas últimas edições em que time saiu com a taça,Redação do ge,"O Palmeiras está cada vez mais forte na briga pelo tricampeonato do Brasileirão. Com a vitória no último domingo, contra o Atlético-MG, o Verdão foi aos 56 pontos e está a um do líder Botafogo.
+ Siga o ge Palmeiras no WhatsApp
A campanha da equipe após 28 rodadas é praticamente igual a de edições recentes em que garantiu a taça. A única exceção é em relação ao ano passado, quando a equipe começou mal e deu uma arrancada surpreendente para superar o próprio Botafogo.
+ CLIQUE AQUI e simule as próximas rodadas do Brasileirão
A pontuação atual do Palmeiras é a mesma da campanha do Brasileirão de 2018 e apenas um ponto abaixo de 2016. Em 2022, o Verdão já somava 60 pontos, a melhor campanha até então.
Mais notícias do Palmeiras:
+ Palmeiras fecha agosto com déficit; veja números
+ Conheça a história de Coutinho
Compare abaixo as últimas campanhas até a 28ª rodada
BRASILEIRO 2024


BRASILEIRO 2023


BRASILEIRO 2022


BRASILEIRO 2018


BRASILEIRO 2016


O aproveitamento de 66% até aqui dá esperança ao torcedor de comemorar mais uma vez ao final da temporada. Um tricampeonato do Brasileirão seria inédito na história do clube.
Para manter a boa sequência, que já tem seis vitórias, o Palmeiras volta a campo no próximo sábado, às 16h30, para encarar o Red Bull Bragantino, fora de casa.
🎧 Ouça o podcast ge Palmeiras🎧
+ Assista a tudo do Palmeiras na Globo, sportv e ge"
"Dudu se declara à torcida do Palmeiras: ""Se pudesse, dava 18 milhões de abraços""",Atacante foi decisivo na vitória contra o Atlético-MG ao entrar e sofrer pênalti,Redação do ge,"Dudu voltou a ser decisivo para o Palmeiras ao sofrer o pênalti que decretou a vitória por 2 a 1 sobre o Atlético-MG, sábado, em Campinas (SP). Um dos personagens do jogo, o atacante se declarou para a torcida pelo carinho que recebeu durante o jogo e neste ano complicado.
+ Siga o ge Palmeiras no WhatsApp
– Falar da torcida é difícil até para mim. Sempre que falo, eu me emociono pelo carinho que eles têm por mim, pela paixão, pelo amor e respeito. Eles podem ter certeza que é o dobro de amor e carinho que eles têm por mim, tenho por eles. Por isso sempre com essa camisa eu tento fazer meu melhor, faço o melhor para voltarem felizes para casa – declarou, à TV Palmeiras.
– Desde o primeiro dia que cheguei, falo em todas as entrevistas, meu objetivo é fazer o torcedor voltar feliz para casa. Se pudesse dar um abraço em cada torcedor palmeirense dava 18 milhões de abraços. Agradeço por tudo, pode ter certeza que é tudo em dobro do que eles sentem por mim. Que vocês continuem acreditando e nos ajudando. Vamos batalhar por este título até o final – completou.
Mais notícias do Palmeiras:
+ Como ""Divertidamente"" ajuda o Verdão na busca pelo título
+ Palmeiras busca o tri no Brasileiro sub-20; veja quem ficar de olho
A temporada 2024 de Dudu tem sido difícil. A começar pela recuperação da cirurgia que realizou no joelho, em agosto do ano passado. Quando estava prestes a retornar, teve a negociação frustrada com o Cruzeiro, que abalou sua relação com a diretoria.
O clube ainda tentou realizar uma troca com o Flamengo envolvendo o camisa 7 e Gabigol, mas por fim decidiu pela permanência do ídolo no elenco.
Sem conseguir retomar o ritmo ideal, chegou a ser tirado das decisões da Copa do Brasil e Libertadores para fazer um processo de recondicionamento físico.
– Eu venho de uma lesão muito séria, muito grave. Quem acompanha meu dia a dia no CT, meu esforço, meu treinamento, estou me esforçando, fazendo trabalhos à parte. Espero continuar ajudando, trabalhando, treinando para pintar mais oportunidades, mais chances, a gente poder jogar mais e continuar na luta por esse título brasileiro aí – respondeu.
Na temporada, o camisa 7 tem 12 jogos, sendo três como titular e ainda busca o primeiro gol e primeira assistência.
O jogo contra o Galo foi o primeiro em 2024 em que Dudu foi decisivo de alguma forma para o resultado. Além da torcida, jogadores e Abel Ferreira festejaram muito o desempenho do atacante, que tem contrato até o fim de 2025, mas futuro ainda incerto.
– Estou treinando muito, quem me acompanha no dia a dia vê meu esforço, que não falta para voltar ao meu melhor ritmo e melhor futebol – completou.
+ Veja mais notícias do Palmeiras
🎧 Ouça o podcast ge Palmeiras🎧
+ Assista a tudo do Palmeiras na Globo, sportv e ge"
"Escalação: Palmeiras terá dois reforços contra o Bragantino, mas lista pode subir para seis novidades","Verdão volta a jogar no próximo sábado, pela 29ª rodada do Campeonato Brasileiro",Redação do ge,"O Palmeiras treinou na manhã desta quarta-feira, e Abel Ferreira realizou atividades táticas já projetando o confronto de sábado, às 16h30 (de Brasília), contra o Bragantino. O Verdão pode ter até seis novidades para o duelo, válido pela 29ª rodada do Brasileirão.
+ Siga o ge Palmeiras no WhatsApp
Duas são certas: Zé Rafael e Richard Ríos estão novamente à disposição após cumprirem suspensão automática contra o Atlético-MG. Os outros possíveis reforços dependem da evolução física na semana.
Mais notícias do Palmeiras:
+ Verdão tem déficit de R$ 28 milhões em agosto
Marcelo Lomba, Mayke, Marcos Rocha e Estêvão estão em transição entre a parte física e técnica após problemas físicos. Todos foram a campo nesta manhã e participaram de ao menos um pedaço do treino com o restante do elenco.
No caso do camisa 41, a tendência é de que ele não seja relacionado, mas isto pode mudar a partir da reação de seu corpo aos treinos na semana. Fora há dois jogos com uma lesão na coxa esquerda, o meia-atacante foi a campo na terça e quarta.
Weverton, que gerou preocupação no jogo contra o Galo após chocar sua mão com Deyverson, não teve lesão detectada e treinou em tempo integral no campo. Não será problema, portanto.
Abel ainda terá mais dois treinos antes de finalizar os preparativos para o jogo contra o Bragantino no estádio Nabi Abi Chedid.
A provável escalação tem: Weverton; Giay, Gustavo Gómez, Murilo e Caio Paulista; Aníbal Moreno, Richard Ríos e Maurício; Raphael Veiga, Felipe Anderson e Flaco López.
Em busca do tricampeonato consecutivo, o Palmeiras é o vice-líder do Brasileirão com 56 pontos, a um do líder Botafogo.
+ Veja mais notícias do Palmeiras
🎧 Ouça o podcast ge Palmeiras🎧
+ Assista a tudo do Palmeiras na Globo, sportv e ge"
"Weverton, do Palmeiras, toma quatro comprimidos após pancada no dedo: ""Já são tortos mesmo""","Goleiro se machuca em dividida com Deyverson, mas fica até o fim para vitória do Verdão sobre o Atlético-MG, pelo Brasileiro",Redação do ge,"Eram segundos de bola rolando no Brinco de Ouro quando Deyverson atingiu a mão de Weverton e deixou o goleiro caído no gramado se queixando de dores no dedo.
Uma infelicidade, como descreveu o camisa 21, mas rapidamente superada - com uma dose de humor e quatro comprimidos - para garantir a vitória do Palmeiras sobre o Atlético-MG, por 2 a 1.
– Foi uma pancada dura, está doendo muito o dedo, mas já tomei uns quatro comprimidos ali. Vamos ver quando fizer o exame o que vai ser, mas acredito que nada porque consegui continuar jogando – iniciou o goleiro, com bom humor na saída de campo.


+ Siga o ge Palmeiras no WhatsApp
E superando ainda a adversidade do vento, que por mais de uma vez influenciou na trajetória da bola durante o jogo em Campinas.
Com a resistência de Weverton e persistência da equipe indo ao ataque, o Palmeiras abriu o placar com pênalti cobrado por Veiga, sofreu o empate em cobrança de falta de Hulk e garantiu a vitória no fim com outro pênalti - sofrido por Dudu e cobrado por Veiga - para fazer 2 a 1.
– O Galo vinha de alto astral pela classificação, a gente sabia que seria difícil, mas a gente se impôs. De todas as adversidades pra um goleiro o vento é a pior. Muda muito, vem rajada de uma hora pra outra. Dar os parabéns a equipe, vem fazendo o que Abel vem pedindo. Uma hora vamos ganhar com tranquilidade, outras com dificuldade, o mais importante eram os três pontos e vamos ver o que acontece na rodada – afirmou.
O resultado amplia a sequência de seis vitórias consecutivas do Verdão, somando 56 pontos e ainda na vice-liderança, mas reduzindo a diferença em relação ao Botafogo para apenas um ponto - após o empate sem gols com o Grêmio.
+ Veja mais notícias do Palmeiras
🎧 Ouça o podcast ge Palmeiras🎧
+ Assista a tudo do Palmeiras na Globo, sportv e ge"
Como Fabinho conquistou Abel Ferreira e se tornou intocável no elenco do Palmeiras para 2025,"Há dez anos no clube, volante não é uma das primeiras opções no meio-campo, mas recebeu elogios do treinador e entende que sua postura é diferencial para ganhar o chefe","Emanoel Araújo, Laura Fonseca e Thiago Ferri","Ao responder sobre Fabinho, Abel Ferreira abriu um sorriso e fez um aviso: não abre mão dele no elenco do Palmeiras de 2025. Mesmo reserva, o volante formado na base alviverde conquistou o treinador e frequentemente recebe elogios. Na sua visão, pela forma como age no dia a dia.
+ Siga o ge Palmeiras no WhatsApp
– O Abel elogia minha postura de ser trabalhador, nunca reclamar. E dentro de campo, a qualidade do passe, o poder de marcação, são meus pontos principais – respondeu o camisa 35 ao ge, citando os motivos que podem tê-lo tornado ""intocável"".
Mais notícias do Palmeiras:
+ Verdão pode ter até seis novidades contra o Bragantino
+ Clube fecha agosto com déficit de R$ 28 milhões
Aos 22 anos de idade, Fabinho chegou em 2015 ao clube, para a equipe sub-13, e está prestes a completar 10 anos no Palmeiras.
Desde sua estreia como profissional, em março de 2021, é um reserva que faz parte de um setor concorrido no grupo, hoje comandado pelo trio Aníbal Moreno, Richard Ríos e Zé Rafael e que ainda conta com Gabriel Menino, outra cria palmeirense.
Ainda que muitas vezes não jogue a quantidade que gostaria, o volante entende que a confiança depositada pela comissão técnica e a evolução que apresentou desde seu início de trajetória no profissional são provas de que vale a pena esperar.
– O Abel é meu primeiro treinador no profissional, sempre me deu confiança. Eu fico feliz de ele contar comigo, e é o que ele sempre fala: continuar trabalhando firme, porque as oportunidades vão aparecer. A gente não sabe quando, mas ele diz que confia e que precisa estar bem para aproveitar as chances que tiver – resumiu.
Contra o Atlético-MG, no último sábado, Fabinho foi escalado como titular, pois Zé e Ríos estavam suspensos, e Menino voltava de lesão. Após o jogo, Abel avisou que o jogador é parte do planejamento já em curso para 2025.


– Trabalha conosco desde que chegamos, e o Fabinho faz parte do núcleo que treina conosco de forma regular. (...) É um jogador certinho, consistente, que pode jogar (como camisa) 5 ou 8, que entende o jogo, tem fluidez, e eu conto. Acrescenta e dá soluções ao meio-campo, consistente quando usado e gratificante para nós. Queremos muito contar com ele para o próximo ano – reforçou.
Com 80 partidas pelo Palmeiras, Fabinho está perto de realizar um sonho: atingir a marca centenária pelo clube que o revelou. Dono de um gol, contra o Corinthians, o camisa 35 tem como meta mais distante jogar na Europa, mas neste momento o foco é outro.
– O Palmeiras tem grandes jogadores, vejo meu crescimento com eles no dia a dia a cada jogo que passa. Estou feliz de estar neste grande clube, sempre brigando por títulos. Cada vez mais quero buscar espaço e jogar mais, e com trabalho as coisas vão acontecer na hora certa – avaliou.
– A gente sonha em jogar na Europa, mas mais para frente. Agora eu penso em ganhar títulos. Também penso na seleção brasileira, deve ser uma sensação indescritível disputar uma Copa do Mundo.
+ Veja mais notícias do Palmeiras
🎧 Ouça o podcast ge Palmeiras🎧
+ Assista a tudo do Palmeiras na Globo, sportv e ge"
Palmeiras fecha agosto com déficit de R$ 28 milhões; resultado no ano ainda é positivo,"Verdão teve gastos acima dos projetados em orçamento no mês, mas resultado somando os oito meses da temporada ainda aponta superávit de quase R$ 130 milhões",Thiago Ferri,"O Palmeiras registrou déficit de R$ 28,3 milhões no mês de agosto, de acordo com o balancete divulgado ao Conselho de Orientação e Fiscalização (COF) e publicado no seu site oficial.
+ Siga o ge Palmeiras no WhatsApp
O resultado foi pior do que o orçado para o mês, em que o clube calculava fechar com um déficit de apenas R$ 742 mil. Ainda que as receitas tenham sido maiores do que o previsto (R$ 74,7 milhões versus R$ 68,3 milhões esperado em orçamento), as despesas também subiram.
Mais notícias do Palmeiras:
+ Verdão banca Caio Paulista após sondar Alex Sandro
A expectativa do Palmeiras era ter R$ 65,7 milhões em gastos no mês de agosto, mas acabou tendo R$ 87,9 milhões.
De acordo com os números apresentados no balancete, despesas com pessoais e encargos sociais, direitos de imagem, amortização com direitos de jogadores e baixas e gastos com vendas de atletas estiveram acima do previsto (veja o comparativo abaixo).
O acumulado na temporada de 2024 é um superávit de R$ 129,2 milhões, bem acima dos R$ 40 milhões projetados para o mesmo período no orçamento da temporada.
As principais fontes de receita de agosto foram:


+ Veja mais notícias do Palmeiras
🎧 Ouça o podcast ge Palmeiras🎧
+ Assista a tudo do Palmeiras na Globo, sportv e ge"
