title,subtitle,author,article_content
Como filme Divertidamente ajudou Palmeiras a colar na briga pelo título brasileiro,"""Posso dizer o que fiz? Convidei-os a ver Divertidamente 1 e 2"", confessa Abel Ferreira, em uma busca por ensinar como administrar emoções no Verdão, que está a um ponto do líder Botafogo",Camila Alves e Thiago Ferri,"Raiva e Alegria dominaram a central de controle de Abel Ferreira, transformando as emoções do treinador, concentrado na própria confiança, para conduzir o Palmeiras à vitória sobre o Atlético-MG, no estádio Brinco de Ouro. E ainda que a cena pareça aleatória, está longe de ser. Porque mostra como um filme ajudou o Verdão a colar na briga pelo título brasileiro - agora a um ponto do líder Botafogo.


+ Siga o ge Palmeiras no WhatsApp
Divertidamente, com a maior bilheteria do século no Brasil, conta a história de Riley, uma menininha entre os 11 e 12 anos de idade, que cresce aprendendo a conviver com as próprias emoções. Mostra as aventuras de Alegria, Raiva, Tristeza, Medo e Nojo, que na pré-adolescência se encontram com Tédio, Vergonha e Ansiedade.
+ Análise: vitória na marra tem velhos heróis e faz Palmeiras colar na briga pela liderança
Na Academia de Futebol, Abel Ferreira quis fazer a equipe entender essas emoções - ainda que nem todos consigam - para aprender quais e em que momentos elas são interessantes de ativar.
– Posso chamar a atenção para deixar os jogadores em paz, ou saudá-los. Todos temos um capeta e um anjinho. Qual quer dar ouvidos? Falo a eles, no jogo é igual. Tenho que falar comigo como a pessoa que mais amo. ""Tu és bom, consegue"". Sem pensar muito na ansiedade, como no Divertidamente 2. Viva aqui e agora. Calma – explica o treinador.
– Sou treinador do Palmeiras, mas tenho carne e osso, tenho medo e escolho a quem quero dar ouvidos. O capeta, querendo azucrinar a cabeça, mas vou ouvir meus valores, o que interessa – completa.
+ ""Ele merece"": Dudu volta a ser decisivo pelo Palmeiras, levanta a torcida e é festejado pelo elenco
E a referência do treinador não é sem motivo.
Divertidamente contou com a consultoria de psicólogos na formulação dos personagens e analogias do filme - entre os nomes citados, Dacher Keltner, Lisa Damour e Paul Ekman - e tem como um de seus trunfos mostrar como cada emoção tem um propósito. Não devem ser evitadas, mas compreendidas.
As palavras do treinador, aliás, lembram o que acontece com a protagonista Riley, que se vê tomada por um misto de emoções enquanto joga hóquei sobre gelo no ginásio da escola, modificando a postura de acordo com a emoção mais dominante - de raiva, medo, alegria, e até a ansiedade, por machucar uma amiga.
Entre os atletas do Palmeiras, Flaco López, que é artilheiro do Verdão no Brasileiro e na temporada, cumpriu o dever de casa. Assistiu ao filme ao lado da namorada, Delfina Apter, e conversou com ela sobre os significados e as emoções que costumam demonstrar.
– Ele em geral seria a Alegria, mas dia após o jogo, é aquele que está tranquilo, deitado, no telefone – conta Delfina, aos risos, em referência ao Tédio.
– Ela é alegre, muito alegre. Tem dias que é o vermelho... a fúria – devolve Flaco.
– Acho que mais a ansiedade do que a fúria – ela explica, compreensiva.
– A gente brincava com isso, mas todo mundo tem um pouquinho de ansiedade. Já teve muitas vezes que tive sim (antes de entrar para os jogos), mas eu levo bem – completa o jogador.
Agora, restando 10 rodadas para o término do Brasileiro e com somente um ponto de desvantagem em relação ao líder Botafogo, administrar as emoções em campo será determinante. Entre momentos de raiva, medo, ansiedade e a esperada alegria, o Verdão caminha para seguir sonhando com o inédito tricampeonato.
+ Veja mais notícias do Palmeiras
🎧 Ouça o podcast ge Palmeiras🎧
+ Assista a tudo do Palmeiras na Globo, sportv e ge"
Análise: vitória na marra tem velhos heróis e faz Palmeiras colar na briga pela liderança,"Em busca do tri consecutivo, Verdão venceu a sexta partida seguida no campeonato e ficou a apenas um ponto do Botafogo, que empatou com o Grêmio nesta rodada",Thiago Ferri,"A sexta vitória seguida do Palmeiras no Campeonato Brasileiro teve antigos heróis: Raphael Veiga, com dois gols, e Dudu, com o pênalti sofrido no fim do jogo, garantiram o triunfo na marra por 2 a 1 contra o Atlético-MG, no estádio Brinco de Ouro da Princesa, em Campinas, pela 28ª rodada.
+ Siga o ge Palmeiras no WhatsApp
Restando dez jogos a disputar no Brasileirão e na caça ao Botafogo, o Verdão está num momento em que além do desempenho consistente, precisa arrancar vitórias quando o cenário não parece favorecer. Foi assim no sábado. Melhor ainda porque o líder empatou com o Grêmio e agora está só um ponto à frente do Verdão.
Mais notícias do Palmeiras:
+ Abel elogia: ""Meus jogadores são incríveis""
+ Quem foi bem? Quem foi mal? Dê suas notas!
Com Caio Paulista e Fabinho nas vagas de Vanderlan e Richard Ríos (suspenso), Abel Ferreira escalou contra o Galo praticamente o mesmo time que venceu o Vasco na rodada passada.
Ainda sem Estêvão, o técnico optou mais uma vez por ter Raphael Veiga na ponta direita, e Felipe Anderson da esquerda. Diante da ausência de um velocista, o Palmeiras teve um jogo mais cadenciado, também buscando Flaco López no pivô com bolas longas.
O volume não foi grande como em jogos recentes, mas o Verdão era melhor que o Atlético-MG. Everson evitou o gol alviverde em duas boas chances de López. A saída para o gol foi uma arma antiga, mas pouco eficaz recentemente: jogada ensaiada.
Em cobrança de escanteio, Veiga cobrou curto para Giay, que tocou para Felipe Anderson na entrada da área. Passe rápido para Maurício, derrubado na área. Pênalti a partir de um lance trabalhado pelo auxiliar Vitor Castanheira, o responsável pelo ajuste de bolas paradas na comissão de Abel.
Raphael Veiga abriu o placar, e o Palmeiras foi para o intervalo sem sofrer sustos. O cenário só começou a mudar com as trocas do Atlético-MG. Do lado esquerdo, a dobra entre Rubens e Arana passou a empurrar a marcação alviverde, e o Galo foi rondando a área.
Ainda assim, Gustavo Gómez e Murilo eram dominantes contra Deyverson e Hulk, mas o camisa 7 fez um golaço em cobrança de falta. Castigo para a queda de desempenho alviverde na etapa final, quando começou a empilhar erros na conclusão de jogadas.
Contra um adversário forte, o Verdão ficou mais amarrado, e Abel começou a mudar. Colocou Lázaro e Rony, mas nenhum dos dois fez diferença. Foi a substituição aos 36 minutos do segundo tempo que alterou o curso do jogo em Campinas.
Quando Dudu entrou no lugar de Fabinho era claro: o Palmeiras partiria para o tudo ou nada. E na primeira participação do camisa 7, ele foi derrubado na área aos 38. Pênalti, para explosão dos palmeirenses no Brinco de Ouro, que nitidamente vibravam mais a cada participação do ídolo.
Veiga mais uma vez na marca da cal, recolocou o Verdão na frente, e a comemoração teve um gosto de recordação para os palmeirenses, com Dudu pulando nas costas do camisa 23 para vibrar.
Os minutos restantes foram do Palmeiras tentando fechar os caminhos do Atlético-MG e garantir o resultado. Dudu ainda teve uma boa finalização, que parou na defesa de Everson.
A festa de atletas e torcida ao apito final dá a dimensão do quão importante era este resultado. Assim como em 2023, o Verdão caça o líder Botafogo. A diferença é menor, mas o adversário também é mais qualificado.
Jogando em casa, restava vencer, portanto. Missão cumprida. A dez jogos do fim, o Palmeiras não deixa o Botafogo escapar e consolida contra um adversário duro seu melhor momento na competição.
De quebra, quem sabe pode ver antigos heróis, antes em baixa, terem importância nesta reta final de luta pelo tricampeonato consecutivo.
+ Veja mais notícias do Palmeiras
🎧 Ouça o podcast ge Palmeiras🎧
+ Assista a tudo do Palmeiras na Globo, sportv e ge"
"""Ele merece"": Dudu volta a ser decisivo pelo Palmeiras, levanta a torcida e é festejado pelo elenco",Atacante entrou no segundo tempo e sofreu o pênalti que garantiu a vitória contra o Atlético-MG,Thiago Ferri,"Dudu voltou a fazer a diferença pelo Palmeiras, até mesmo na atmosfera. Na noite de sábado, no Brinco de Ouro, ganhou festa ao sair do banco, gritos de incentivo ao pegar na bola e cantos de ""Dudu guerreiro"" após ser decisivo, com 38 minutos do segundo tempo, por sofrer o pênalti que garantiu a vitória por 2 a 1 sobre o Atlético-MG.
Uma noite para guardar na memória, como parte da retomada em uma dura trajetória, que teve o retorno de lesão, a negociação frustrada com o Cruzeiro que abalou o clima nos bastidores, e um período fora para recondicionamento físico no meio das decisões de mata-mata no Verdão.
– Ele merece, porque trabalha muito e sabe o quanto difícil é. Deixei de jogar por uma lesão dessas – disse Abel Ferreira, em referência à ruptura de ligamento cruzado do atacante.
– Se me perguntar se o Dudu está pronto para os 90 minutos, não está. Mas, se puder ajudar como foi, será espetacular. Ele tem carinho da comissão técnica, do grupo, e mais do que falar, é olhar os gestos do grupo. Vou voltar a referir, todos somos um, todos somos um, todos somos um – completou o treinador.
+ Siga o ge Palmeiras no WhatsApp
+ Veja as atuações e dê suas notas
+ Weverton toma quatro comprimidos após pancada no dedo: ""Já são tortos mesmo""
Dudu esteve por nove meses afastado dos gramados por conta da cirurgia no joelho, retornou em junho e, aos 32 anos, ainda trabalha de forma gradual para ganhar ritmo depois de lesão.
Por mais de uma vez, inclusive, acostumou-se a fazer treinos suplementares ao fim das atividades na Academia de Futebol. Até a última noite, havia feito apenas 11 jogos no ano, sendo três como titular, com nenhum gol ou assistência.
+ Veja o que disse Abel Ferreira após o jogo
Na noite em que se viu como peça importante para o resultado pela primeira vez no ano, Dudu foi alvo de abraços na comemoração do gol e também ao apito final, não só do treinador - que entrou em campo ao fim do jogo -, mas também dos companheiros, que veem de perto a recuperação do ídolo alviverde.
– Estava mais próximo dele neste momento mais turbulento, vi um pouco do que ele passou, e poder celebrar este jogo, em que ele mudou o jogo, com pênalti, finalização, contra-ataque. Fico muito feliz. A gente tem que olhar o ser humano atrás de cada pessoa. A alegria do Dudu é minha alegria, o que puder fazer para ajudar o Dudu e outras pessoas do elenco vou fazer – comemorou Raphael Veiga.
Ao longo dos 16 minutos que esteve em campo, o atacante tentou três passes - acertando todos -, arriscou uma finalização e sofreu uma falta, justamente a cometida por Rubens, que resultou no pênalti cobrado e convertido por Veiga na reta final.
Do lado oposto do campo, mas com uma visão ampla do time pela frente, o goleiro Weverton usa uma frase motivacional para resumir a caminhada do companheiro: ""o curto prazo nem sempre é justo, mas o longo é.""
– Ele é o primeiro a chegar no trabalho, faz o melhor e está colhendo o que vem plantando com muito trabalho, dedicação e quem ganha é a gente, que tem um craque dentro de campo. Acho que de tudo que aconteceu, as pessoas esquecem a lesão dele. É dura, difícil. Ele está voltando à melhor forma, em um momento importante para nos ajudar e estamos felizes por tudo que ele fez no jogo.
O Verdão terá mais uma semana completa para trabalhar e entra em campo novamente às 16h30 do próximo sábado, dia 5 de outubro, contra o Bragantino, no estádio Nabi Abi Chedid.
+ Veja mais notícias do Palmeiras
🎧 Ouça o podcast ge Palmeiras🎧
+ Assista a tudo do Palmeiras na Globo, sportv e ge"
Estêvão e Marcos Rocha iniciam transição física no Palmeiras; Weverton não tem lesão,"Dupla se recupera de lesões e se tornam possibilidades para o jogo de sábado, contra o Bragantino; goleiro fez exames na mão direita após pancada no jogo contra o Atlético-MG",Redação do ge,"O treino do Palmeiras nesta terça-feira teve duas boas notícias. O atacante Estêvão e o lateral-direito Marcos Rocha foram a campo e iniciaram o processo de transição física. Ambos cumpriram cronograma interno e também no gramado.
+ Abel e elenco profissional vão ao Allianz Parque
Apesar de avançarem em suas recuperações, os dois não estão garantidos no jogo do próximo sábado, às 16h30, diante do Red Bull Bragantino, fora de casa, pelo Campeonato Brasileiro.
Assim como Mayke, que também está em processo de transição, eles devem ter o retorno gradual aos confrontos para evitar novos problemas médicos.
Mais notícias do Palmeiras:
+ Dudu se declara à torcida após vitória
+ Veja quem ficar de olho no time sub-20
Além disso, o lateral-esquerdo Piquerez avançou no tratamento da cirurgia no joelho esquerdo e fez movimentações no campo com a fisioterapia. Já Weverton realizou um trabalho interno, passou por avaliações e não teve detectada nenhuma lesão nos dedos da mão direita, onde levou uma pancada no jogo passado.
Aqueles que foram a campo nesta terça fizeram um trabalho técnico de aproximação, marcação e posse de bola, com duas equipes (sem goleiros) e três ""minimetas"" dispostas nas linhas de fundo.
Na sequência, também com dois times, foi colocada em prática uma atividade técnica com outras dinâmicas e com a presença dos goleiros. No final, alguns atletas realizaram complementos físicos.
+ Siga o ge Palmeiras no WhatsApp
+ Veja mais notícias do Palmeiras
🎧 Ouça o podcast ge Palmeiras🎧
+ Assista a tudo do Palmeiras na Globo, sportv e ge"
Abel e jogadores assistem ao Palmeiras campeão do Brasileirão Sub-20 no Allianz Parque,"Verdão venceu Cruzeiro por 3 a 0, somando 5 a 2 no placar agregado para conquistar o título",Camila Alves,"Vitor Reis subiu ao gramado do Allianz Parque, permaneceu no campo durante todo o aquecimento e desceu ao vestiário com a equipe Sub-20 do Palmeiras - prestigiando os amigos da base na final do Brasileirão, em que o Alviverde venceu o Cruzeiro por 3 a 0 e sagrou-se campeão, na noite desta segunda-feira. Mas ele esteve longe de ser o único.
No camarote do estádio, estiveram também um descontraído Abel Ferreira - sorridente durante a partida -, membros da comissão técnica e pelo menos uma dezena de jogadores da equipe profissional.
+ Siga o ge Palmeiras no WhatsApp
Entre os atletas, também marcaram presença Marcos Rocha, Agustín Giay, Felipe Anderson, Flaco López, Vanderlan, Gustavo Gómez, Piquerez, Aníbal Moreno, Mayke, Michel e Dudu.
Os auxiliares João Martins e Tiago Costa, da comissão técnica portuguesa, também estiveram no estádio durante esta segunda-feira.
O Allianz Parque abriu os portões com entrada gratuita e recebeu 23.327 torcedores e torcedoras para fazer a festa pelo Sub-20 alviverde, agora campeão do Brasileiro pela terceira vez.
+ Veja mais notícias do Palmeiras
🎧 Ouça o podcast ge Palmeiras🎧
+ Assista a tudo do Palmeiras na Globo, sportv e ge"
Atuações do Palmeiras: Raphael Veiga volta a decidir e é o melhor em vitória; dê suas notas,"Veja as notas dos jogadores do Verdão na partida contra o Atlético-MG, pelo Brasileiro",Thiago Ferri,"+ Siga o ge Palmeiras no WhatsApp
+ Veja mais notícias do Palmeiras
🎧 Ouça o podcast ge Palmeiras🎧
+ Assista a tudo do Palmeiras na Globo, sportv e ge"
