title,subtitle,author,article_content
"Rafael Paiva diz que Vasco não foi se defender em Minas e avisa: ""Sangrar muito para vencer""",Time perde de 2 a 1 para o Atlético-MG de virada e decide a vaga para a final da Copa do Brasil em São Januário no dia 20. Treinador prefere não adiantar dupla de zaga para confronto decisivo,Bruno Murito,"O Vasco perdeu de virada a primeira partida da semifinal da Copa do Brasil: 2 a 1 para o Atlético-MG, na Arena MRV, em Belo Horizonte (MG), nesta noite de quarta-feira. Philippe Coutinho marcou para os vascaínos, e Guilherme Arana e Paulinho fizeram para o Galo.
+ Atuações do Vasco: Léo, Puma e Piton são os piores em derrota; dê suas notas
O técnico do Vasco, Rafael Paiva, disse que o time busca formação mais agressiva e vai manter a ideia para a partida de volta em São Januário para chegar na grande decisão.
- Não era o resultado que a gente veio buscar, a gente não veio pra se defender aqui, a gente sabe da força do Atlético, a gente também sabe que é muito difícil. Mas nós saímos com o sentimento de que o jogo está vivo. Em São Januário somos muito fortes. Nessa competição, na Copa do Brasil, a gente foi muito forte em todos os jogos e a gente sai com a sensação que a gente vai fazer de tudo pra passar - disse Paiva, que mais adiante na coletiva de imprensa reforçou:
- Vamos ter que sangrar muito para vencer. Para nós vai ser uma guerra. Tem que ser encarado como uma guerra, a gente tem que ir para o jogo do tudo ou nada. A gente não pode em nenhum momento pensar que a gente não vai conseguir A gente não pode ficar colocando o peso do Atlético, da capacidade que eles têm, que a gente conhece, a gente tem que fazer o nosso dever de casa e ir agredir o Atlético o tempo todo. Tirar a bola do Atlético, buscar gol o tempo todo. A gente tem que jogar no nosso limite porque está valendo uma final e a gente quer chegar muito nessa final. A gente tem, internamente, certeza que a gente pode conseguir - afirmou o treinador.
A partida de volta está marcada para São Januário, no dia 19, às 18h30. Quem avançar pega o vencedor de Flamengo e Corinthians, que disputam a outra semifinal. O Galo vai com vantagem do empate para o Rio de Janeiro. Vitória vascaína por um gol de diferença leva a decisão para os pênaltis.
O treinador convocou os torcedores para a partida da volta em casa e lembrou da força do grupo em situações semelhantes até agora na Copa do Brasil:


Antes da Copa do Brasil, o Vasco tem dois compromissos pelo Campeonato Brasileiro. Primeiro, enfrenta o Juventude, no sábado, às 21h, em São Januário. Depois, na quarta que vem, joga contra o São Paulo, no Morumbis, às 21h45 - em partida invertida pela CBF com a semi da Copa do Brasil por pedido do Atlético-MG. O Vasco tenta recurso no STJD contra a alteração.


Por mais de uma oportunidade, Paiva precisou responder sobre a dupla de zaga vascaína. Na partida do último fim de semana - empate por 1 a 1 contra o Cruzeiro - jogaram juntos Léo e João Victor, mas nesta quarta-feira Paiva resolveu colocar de volta Maicon e tirou João Victor.
- Na minha opinião, a gente conseguiu resgatar nossas duplas de zaga. Acho que eles vinham de bons jogos, essa era uma dúvida que a gente tinha, cada um com a sua particularidade, o Léo vinha de bons jogos, é um zagueiro canhoto. Isso faz diferença, do que você jogar com dois destros, mas eu sempre falei: eu acho que a gente tem três zagueiros ali que estão numa disputa aberta. Para esse jogo também era e a gente optou pelo Maicon e pelo Léo. Agora os próximos jogos a gente tem que ver - afirmou o treinador do Vasco.
Ele lembrou que antes da partida de volta da Copa do Brasil o Vasco tem dois duelos fundamentais pelo Campeonato Brasileiro. O Vasco tem 36 pontos e ocupa a 9ª colocação na tabela. O técnico entende que o Vasco evolui com nova postura em campo.
- O Juventude é uma final para nós. A gente precisa dar a resposta do Campeonato Brasileiro, e temos o jogo do São Paulo ainda antes do Atlético de novo. A gente tem jogado num limite de erro mais alto, a gente tem tentado ser mais agressivo. A gente tem tentado jogar pressionando o adversário fora de casa no campo deles. E a gente sabe que a gente fica mais exposto ao erro. Acho que incomodava muito o torcedor do Vasco quando a gente ficava atrás, com os zagueiros muito próximos do Leo Jardim, e a gente tem tentado mudar isso. Mas a gente sabe que é um processo - comentou.
- Nesse nível de jogo é muito difícil, fora de casa, marcar da forma que a gente tentou marcar e eu acho que isso faz parte do processo. A gente tem que ir para frente, o erro de um é o erro de todo mundo. E a gente vai jogo a jogo revendo as nossas estratégias, tentando sempre buscar vitória. Evoluir o Vasco como um conjunto, como uma equipe. Para ser equipe mais agressiva - disse Paiva, que havia sido questionado sobre as críticas contra Léo dos torcedores na partida contra o Galo.






- Internamente a gente fala muito com os atletas. A gente sabe que o próximo passo que a gente tem que dar é ter mais o controle do jogo com a bola. Então acho que em alguns momentos a gente consegue, mas a gente oscila dentro do mesmo jogo. A gente consegue ter boas transições, hoje a gente fez um gol de contra-ataque que é uma marca que o Vasco tem. A gente consegue quebrar pressão em alguns momentos, a gente não consegue sustentar isso por um jogo todo. Então a gente sabe que a gente tem que trabalhar muito, nós temos total consciência disso e a gente vai continuar trabalhando. De novo, também acredito que é um processo que já está melhor do que alguns jogos atrás, mas nesse nível de jogo, do Atlético, para onde a gente quer chegar no Campeonato Brasileiro, a gente precisa ter uma criatividade mais alta. A gente está trabalhando muito em cima disso e a gente tem que evoluir, tem que evoluir porque agora a gente quer ser agressivo, a gente quer marcar, mas a gente também precisa jogar. Então a gente tem consciência disso. Está buscando aprimorar.


- Sempre tenho falado aqui que a gente tem que ter paciência porque ele está se recondicionando. É um jogador que a gente precisa ter ele em campo sempre. A gente tem o terceiro jogo agora, contra o Juventude, num período de menos de uma semana. Então a gente precisa ter muita cautela para o próximo jogo. Mas acredito que ali (na saída de campo com dores) foi mais uma cãibra mesmo, foi mais pelo esforço. Ele correu muito. A gente gostaria de ter um controle maior ali da bola para ele ter que correr menos, mas a gente tem que se esforçar muito para a gente conseguir principalmente fora de casa, manter uma estrutura alta ali. E ele sentiu, como todos os outros jogadores também sentiram fisicamente em algum momento. Mas não acho que é nada que preocupe.




- O Alex ficou um tempo fora. Ele teve uma lesão não grave, mas teve e estava se recondicionando também. Mas é um jogador muito experiente. Nesse nível de jogo faz muita diferença quando você tem um cara mais acostumado. A gente tem testado várias opções, a gente tem tentado perceber qual é o melhor caminho ali (na direita). A gente perdeu o Adson, a gente perdeu o David, dois jogadores importantes e a gente não pode ficar só remoendo a ausência desses dois jogadores. A gente tem que buscar soluções pra gente perceber o que vai encaixar melhor. Então a gente está testando, a gente está trabalhando alguns jogadores, têm dado grandes respostas ali e a gente vai tentar buscar o melhor caminho pra cada jogo. Hoje a gente conseguiu colocar o Alex por 15 minutos mais ou menos. É mais um jogador experiente que a gente ganha lá na frente. Ganha nos momentos que a gente vai precisar rodar o grupo e é um jogador qualificado. A gente está tentando ter mais jogadores desse nível aptos na hora que a gente precisar.


- Maxime tem treinado bem. É um jogador que está se adaptando à velocidade do jogo. Aqui é um jogo mais intenso, é um jogo que dá um pouco menos de espaço. E eu acho que ele está se adaptando bem, eu acho que é mais um jogador que poderia ter entrado nesse jogo. A gente optou pelo (Jean David) Menezes, que tinha jogado o jogo contra o Cruzeiro, então a gente quis ganhar esse ritmo de jogo que o Menezes teve contra o Cruzeiro. Mas é um jogador que está a ponto de entrar e dar conta do recado. É um jogador técnico, é um jogador que dá fluidez de jogo para a gente. Acho que a qualquer momento a gente inicia um jogo com ele ou coloca ele no decorrer do jogo, mas ele está nos planos e tenho certeza que ele vai nos ajudar bastante.


- Eu acho que tem um peso grande sim. A gente teve os nossos zagueiros contestados por muito tempo. Acho que a gente está conseguindo dar uma resposta, eu sinto que hoje o Vasco é uma equipe equilibrada, é uma equipe que consegue se portar bem defensivamente. A gente conseguiu melhorar o futebol dos nossos zagueiros e a gente tem que ir para o jogo com o que a gente quer, a melhor opção. Acho que o João Victor é um zagueiro fantástico também, fez um grande jogo contra o Cruzeiro, tem a sua característica de jogo, é um zagueiro veloz. O Maicon é um zagueiro muito experiente, corta muito caminho, é um jogador que dentro da área é muito forte. O Leo é um zagueiro rápido, canhoto, acho que cada um tem a sua característica, mas é importante quando chegar ao jogo do Atlético a gente perceber quem vai estar mais pronto, acho que para analisar todos os detalhes. Não dá para cravar aqui agora para você o que a gente vai colocar porque a gente tem dois jogos antes pela frente e a gente vai trabalhar da melhor maneira possível para a gente colocar os dois que vão estar mais aptos e vão conseguir fazer um grande jogo tanto quanto contra Atlético, assim como contra o Juventude e São Paulo, mas a gente tem que ter paciência ali pra gente perceber o que vai acontecer e a gente vai dar uma resposta para a torcida dentro de campo. É o mais importante.
+ ✅Clique aqui para seguir o novo canal ge Vasco no WhatsApp
+ Leia mais notícias do Vasco


Assista tudo sobre o Vasco no ge, na Globo e no SporTV:"
"Cria do Atlético-MG e campeão com o Vasco, Eder Luis revisita passado e revela torcida na Copa do Brasil",Ex-atacante se aposentou em 2020 e trabalha como agricultor no interior de Minas Gerais,Emanuelle Ribeiro,"Quatro anos depois de se aposentar, Eder Luis leva uma vida pacata no interior de Minas Gerais, estado onde começou a jogar futebol profissionalmente e ganhou projeção nacional com a camisa do Atlético-MG. Mas foi no Rio de Janeiro onde o ex-atacante foi mais feliz na carreira, ao conquistar a Copa do Brasil com o Vasco em 2011, título mais importante do clube no século 21.
+ Vasco rebate Flamengo sobre alteração das datas da Copa do Brasil: ""Boa fé: você tem ou não""
Nesta quarta-feira, às 19h15, os dois ex-times de Eder Luis começam a disputar vaga na final da Copa do Brasil de 2024. O primeiro jogo da semifinal será na Arena MRV. Apesar de se identificar tanto com o Galo quanto com o Vasco, o coração pesa mais para um lado.
- Por ter jogado sete anos no Vasco, o Atlético que me perdoe, hoje minha torcida é mais para o Vasco. Não diminui meu carinho pelo Atlético. Mas, se pesar, o Atlético teve muitos ídolos depois que eu saí. No Vasco não, eu marquei com um título que a torcida tanto esperava. Acredito que sou mais ídolo no Vasco, então minha torcida é para eles - disse Eder, em papo com o ge.
Eder Luis vingou no Atlético-MG com o título da Série B de 2006, foi campeão brasileiro com o São Paulo em 2008, autor de um dos gols do Vasco na final da Copa do Brasil de 2011, além de conquistar Taça da Liga e Campeonato Português pelo Benfica.
+ Hulk e Léo Jardim travam mais um duelo na semifinal Atlético-MG x Vasco
Ao parar de jogar futebol em 2020, quando atuou pelo Uberlândia no Campeonato Mineiro, o ex-atacante voltou para as origens e é agricultor na cidade do Triângulo Mineiro. Ele divide os dias entre a cidade e a roça, onde trabalha com plantação de soja. Apesar de gostar do sossego, Eder Luis sente falta de momentos como o que os jogadores de Atlético-MG e Vasco vão vivenciar nesta noite.
- Independentemente da pressão que tem, é uma profissão privilegiada. Eu sinto falta. Está aí o Vasco, vivendo esse ano com uma pressão danada, quem não queria estar agora participando dessa semifinal? Tenho certeza que os jogadores não veem a hora de estar em campo jogando.


Eder começou a jogar futebol na base do Comercial-SP aos 14 anos. Foi captado pelo Galo depois de se destacar em um clássico local, contra o Botafogo de Ribeirão Preto. Os olheiros do clube mineiro estavam atrás do goleiro Diego Alves, mas levaram também o atacante que marcou dois gols no jogo.
A estreia no profissional aconteceu em 2005. No ano seguinte, Eder Luis foi integrado de vez ao elenco e se destacou na conquista da Série B, momento que o torcedor atleticano pode não gostar de reviver, mas que foi fundamental para a carreira do jogador decolar.
- O Atlético-MG abriu as portas para mim, foi onde eu tive a oportunidade de desenvolver meu sonho. Dou graças ao Atlético por estar onde estou. Não tem como não falar da Série B de 2006, é algo pequeno para a história do Galo, mas eu e muitos jogadores que subiram ali pegamos um clube num momento financeiro muito difícil. Ninguém esperava estar naquela Série B, mas o Atlético apostou na gente e conseguimos não só subir, mas ser campeões com autoridade. Para olharmos para o Atlético hoje, a gente tem que lembrar lá atrás. Mas não começamos bem - recordou ele.
- Teve uma parada para a Copa do Mundo, e nós não tivemos férias. O time estava muito mal, o Levir Culpi chegou, e nossa equipe trabalhou muito. A gente treinou muito em Atibaia, foram dias intensos e a partir dali a gente entrou no campeonato. Começamos a ganhar, ganhar, ganhar. Foi um momento decisivo para a gente chegar ao título - completou.
+ ✅Clique aqui para seguir o novo canal ge Vasco no WhatsApp
Em 157 jogos com a camisa do Atlético-MG, Eder marcou 42 gols. A temporada mais artilheira foi em 2009, com 21 gols em 56 partidas no ano em que o clube brigou pelo título em boa parte do Brasileirão. O jogador deixou Belo Horizonte no ano seguinte para o Benfica e, em seguida, retornou ao Brasil para defender o Vasco.


Depois de uma passagem curta por Portugal, Eder Luis foi emprestado ao Vasco. O destaque no Rio fez o clube carioca comprá-lo do Benfica. Foram sete temporadas defendendo a camisa vascaína, com 29 gols em 207 jogos.
- Por ser protagonista, no Vasco foi totalmente diferente. Também estava mais maduro, um jogador diferente. Foi um momento muito bom, o Vasco não chegava há um longo período em campeonatos de peso, foi um feito bom, e até hoje vejo os vascaínos muito gratos. Agora nessa decisão fica essa lembrança do que fizemos - destacou Eder, que acrescentou:
- Foi um ano em que a gente não começou muito bem, muitos problemas financeiros, o time não engrenava. O momento decisivo foi quando chegou o Ricardo Gomes, um treinador que era para aquele momento. O time estava mal, e ele só falou: ""Calma que as coisas vão se ajeitar"". Treinamos na semana e ganhamos do Comercial-MS por 6 a 1. Aí o time parece que ficou tranquilo. Outro momento foi na final. Fomos para o vestiário perdendo por 2 a 1, com a torcida inflamada com o segundo gol do Coritiba, e ele falou a mesma coisa: ""Calma que as coisas vão se ajeitar, a gente sabe o que precisa ser feito"". Não falou mais nada, e a gente retomou o controle do jogo. Ele trazia muita calma.
+ Leia mais notícias do Vasco
Lembrado com carinho pelos vascaínos, Eder Luis retribui o reconhecimento com a torcida pelo Vasco. Ele tem acompanhado a campanha do time na temporada e vê semelhanças com o caminho que traçou em 2011. A diferença em 2024, na visão dele, é que o clube está mais organizado.
- Todo mundo vai falar que o Atlético é favorito, se for pensar nas contratações, é um clube mais estabilizado. O Vasco melhorou com o Pedrinho, é uma pessoa muito séria, coerente com o que tem que ser feito, conhece bem o futebol, não está ali só por ser ídolo. Torço para que ele ganhe esse campeonato para que as coisas fluam mais facilmente. E o Vasco tem me surpreendido porque tem valorizado até as derrotas, é um time que não entrega fácil, luta muito, ganhar do Vasco é muito difícil. Por isso não acho que o favoritismo do Atlético é tanto - afirmou Eder.
- O segundo jogo é em casa, então se o Atlético não tiver uma vantagem grande a volta vai ser bonita de ver. São Januário é um caldeirão e, nesses momentos decisivos, favorece demais. Tivemos momentos difíceis na Copa do Brasil de 2011, como eu vejo o Vasco de hoje. As mesmas dificuldades que a gente tinha lá atrás, o Vasco tem hoje, da forma como está classificando - concluiu o ex-atacante.


Assista tudo sobre o Vasco no ge, na Globo e no SporTV:"
O artilheiro e o paredão: Hulk e Léo Jardim travam mais um duelo na semifinal Atlético-MG x Vasco,"Desde que chegou ao Vasco, ninguém obrigou o goleiro a fazer mais defesas do que o atacante do Galo. Jardim levou a melhor nos dois encontros em 2023, mas Hulk marcou duas vezes este ano",Leandro Silva e Tébaro Schmidt,"O confronto entre Atlético-MG e Vasco pela semifinal da Copa do Brasil, que começa a ser disputado nesta quarta-feira, na Arena MRV, será mais uma edição do duelo entre Hulk e Léo Jardim. O artilheiro do Galo versus o paredão vascaíno.
+ Jean David, dobra de laterais... Quais as opções sem David?
Hulk e Léo Jardim travaram duelos interessantes em jogos recentes. O goleiro levou a melhor nas duas partidas entre as equipes pelo Brasileirão do ano passado, em ambas sendo protagonista com defesas importantes. E o atacante se redimiu nesta temporada marcando os dois gols da vitória do Atlético-MG no primeiro turno.
De acordo com levantamento do Espião Estatístico, em jogos do Brasileirão, nenhum outro jogador obrigou o goleiro a fazer mais defesas do que Hulk. Foram sete intervenções nas três partidas entre Atlético-MG e Vasco.
Quem mais parou em defesas de Léo Jardim?


+ Vasco recupera moral de zagueiros e tem disputa aberta entre Maicon, Léo e JV
Em 2023, o Vasco venceu os dois jogos do Brasileirão contra o Atlético-MG: 2 a 1 no Mineirão e 1 a 0 no Maracanã. Nas duas partidas, Léo Jardim foi protagonista com defesas importantes (veja as principais no vídeo que abre a matéria). Ele pegou cobrança de falta, chutaço de primeira, finalização perigosa da entrada da área...
Já no primeiro turno do Brasileirão deste ano, em partida realizada em julho, o Galo venceu por 2 a 0 na Arena MRV, os dois gols marcados por Hulk. No primeiro, ele apareceu na segunda trave para completar de cabeça o cruzamento de Gustavo Scarpa. E, no segundo, aproveitou a bola mal recuada por Praxedes, deixou Léo Jardim no chão e empurrou para o gol vazio.
Atlético-MG e Vasco fazem o primeiro jogo da semifinal da Copa do Brasil nesta quarta-feira, às 19h15 (de Brasília), na Arena MRV. A volta está marcada para o dia 20 de outubro, em São Januário."
Vasco entra com ação no STJD contra mudança de data na Copa do Brasil,Departamento jurídico da SAF se baseia em artigos do Regulamento Geral de Competições e protocola Medida Inominada no tribunal. Corinthians também vai entrar com ação,Raphael Zarko,"O Vasco acaba de entrar com Medida Inominada no Superior Tribunal de Justiça Desportiva (STJD) contra as trocas das datas dos jogos de volta da semifinal da Copa do Brasil. O clube entende que ""Atlético-MG e Flamengo estão sendo beneficiados"" e, em última análise, não descarta ir à Justiça comum.
Leia também:
+ Pedrinho reage à decisão da CBF ""O Vasco está indignado""
+ Dirigente diz que mudança fere dois artigos de regulamento
A ação é da Vasco SAF e vai ser acompanhada pelo Corinthians em um segundo momento, com o mesmo objetivo. O clube paulista se juntou à reclamação do presidente Pedrinho e do diretor de futebol vascaíno Marcelo Sant'Ana contra as alterações divulgadas pela CBF.
O clube espera conseguir a anulação no STJD, mesmo sabendo que é um terreno de dura disputa contra a CBF, que tem natural influência sobre as comissões e indicações no tribunal.
Mas também conta na estratégia jurídica com o primeiro vice-presidente geral do Vasco, Paulo Salomão, ex-presidente do STJD. O escritório que defende o Vasco é de Luciana Lopes, advogada do clube em mais de uma gestão nos últimos anos. Ela é filha do presidente da Ferj, Rubens Lopes.


""O Vasco da Gama informa que, nesta segunda-feira (30/09/2024), protocolou junto ao Superior Tribunal de Justiça Desportiva (STJD) uma medida inominada, com pedido de urgência, questionando a alteração unilateral das datas das partidas de volta das semifinais da Copa do Brasil 2024 pela Confederação Brasileira de Futebol (CBF).
A referida modificação, realizada sem o consentimento do Vasco e de maneira contrária ao calendário previamente estabelecido, viola tanto a Lei Geral do Esporte quanto o Regulamento Geral de Competições da própria CBF. O clube reafirma seu compromisso com o respeito às normas e à isonomia no futebol nacional.
O Vasco aguarda e confia que a Justiça reestabeleça a tabela definida originalmente e que o jogo da volta da semifinal da Copa do Brasil aconteça nas datas previamente estabelecidas, sendo elas 16 ou 17/10.
VASCO DA GAMA SAF""
A proposta havia partido de um pedido do Atlético-MG, que provavelmente terá jogadores convocados na Data Fifa - um deles, é Guilherme Arana, selecionado por Dorival Júnior para defender o Brasil. O Vasco já havia recusado a solicitação formal da entidade para mudar o dia do segundo jogo da semifinal.
O Vasco se baseia em artigos do Regulamento Geral de Competições (RGC) para ir ao tribunal desportivo:


+ ✅Clique aqui para seguir o novo canal ge Vasco no WhatsApp
+ Leia mais notícias do Vasco


2 de outubro




19 de outubro


20 de outubro




Assista tudo sobre o Vasco no ge, na Globo e no SporTV:"
