title,subtitle,author,article_content
Campbell projeta possível duelo contra Depay no jogo de sábado,"Astro do Corinthians pode estrear contra o Atlético-GO, na Neo Química Arena; há 10 anos, costarriquenho e holandês se enfrentaram em Salvador, na Copa do Mundo do Brasil",Redação do ge,"A partida entre Atlético-GO e Corinthians, sábado, pode colocar frente a frente Joel Campbell e Memphis Depay. O astro holandês vive expectativa de estrear pelo novo clube, e o meia-atacante do Dragão projetou o que espera do jogo na Neo Química Arena, em São Paulo.
Vale lembrar que um duelo entre eles no Brasil não é inédito. Campbell e Depay se enfrentaram na Copa do Mundo de 2014, com a Holanda eliminando a Costa Rica nas quartas de final, nos pênaltis.
- Vai ser uma partida muito importante para nós. Vamos jogar muito do que signigica a temporada nessa partida. Sabemos que o Corinthians é uma equipe grande do Brasil e que estão ansiosos pela primeira partida de Memphis (Depay). Mas penso que temos que nos preocupar conosco. Em treinar bem e fazer uma boa partida, pois precisamos dos três pontos para sair da zona de rebaixamento. Perdemos três pontos contra o Vitória e temos obrigação de buscar fora agora - disse Campbell.
O costarriquenho também falou da situação delicada do Atlético-GO. O clube segue afundado na lanterna do Brasileirão e precisa de uma arrancada histórica na reta final do torneio para escapar do rebaixamento. Apesar do cenário improvável, Campbell diz que é importante continuar acreditando na permanência.
- Penso que temos que acreditar em nós mesmos. Acreditar no trabalho que fazemos. É difícil, pois a Série A é bastante difícil. São partidas muito difíceis. Mas matematicamente, há possibilidade. No futebol, qualquer coisa pode acontecer. Temos que seguir trabalho e nos reforçando, pois, se estamos vivos, temos que lutar - afirmou o jogador.
+ Jorginho passa por cirurgia e pode ser desfalque por dois meses"
Atuações do Atlético-GO: Janderson mostra disposição e decide contra o Fluminense,Atacante ajuda na defesa e ainda marca o gol da vitória rubro-negra; Hurtado praticamente não toca na bola,Redação do ge,"Janderson: Foi o autor do gol da vitória, mas não só isso. Muito voluntarioso, correu demais, recompôs na defesa e quando a chance surgiu, decidiu no ataque. Nota: 7,0
Rhaldney: Tomou conta do meio de campo. Ajudou na marcação e apareceu bem na frente. Quase marcou, mas ficou na trave. Nota: 6,5
Jean Carlos: Em sua estreia pelo time profissional, o meia de 19 anos mostrou que pode ajudar. Ele participou do lance do gol e ainda teve chance de fazer o segundo, cara a cara com Fábio, mas acabou parando no goleiro. Nota: 6,5
Hurtado: O camisa 9 até que tem disposição, mas foi peça quase nula em campo. Apesar da correria, praticamente não tocou na bola durante a partida. Nota: 4,5







"
Louzer cobra comportamento diferente do Atlético-GO contra Corinthians em ascensão,Técnico diz que time rubro-negro precisa acreditar na vitória e fazer por onde,Redação do ge,"O Atlético-GO tem pela frente no sábado o Corinthians, que vem em ascensão na Série A e também segue vivo na Sul-Americana e na Copa do Brasil. Diante desse cenário adverso, Umberto Louzer diz que o Dragão precisa, primeiramente, crer na vitória. Dito isso, ele vem trabalhando o aspecto mental da equipe e aposta em uma postura diferente em relação à derrota para o Vitória no fim de semana, em pleno Antônio Accioly.
- Sabemos o que iremos enfrentar. O Corinthians vive um momento de crescimento. Seja na competição sul-americana (Copa Sul-Americana) ou no Brasileiro, no qual também vem fazendo bons jogos. Tudo que tem sido falado e mostrado sobre estreia de atletas (Depay) nós não controlamos. Controlamos o que vamos ministrar nos treinos e no ajuste para motivar nossos atletas. Queremos ir lá e representar bem a nossa camisa. Vamos precisar ter um comportamento diferente.
Louzer reforça que não ficou satisfeito com o desempenho do Atlético-GO na última derrota e que o rendimento em campo precisa ser outro para o clube continuar sonhando com permanência.
- A primeira atitude é o desejo pela vitória. É preciso desejar e entender que temos capacidade de vencer. Depois passamos para o plano material. Ações, execuções, nossas ações, atitude e comportamento. É o que temos trabalhado. Se não acreditarmos que é possível fazer um grande jogo e conseguir a vitória, não temos nem que viajar. Nos incomodou muito nosso comportamento contra o Vitória. Então, precisamos dar uma resposta - cobra o treinador.
O duelo contra o Corinthians será na Neo Química Arena, sábado, às 16h. O Dragão é o lanterna do Brasileirão com apenas 18 pontos, enquanto o adversário paulista ocupa a 18ª posição, com 25."
Atlético-GO inicia preparação para enfrentar o Fluminense; Campbell está fora,Dragão volta a campo no próximo domingo; jogador da Costa Rica está suspenso pelo terceiro cartão amarelo,Redação do ge,"Depois de perder para o Corinthians no último sábado, o Atlético-GO iniciou nesta segunda-feira a preparação para enfrentar o Fluminense. O próximo jogo do Dragão será domingo, às 16h, no Antônio Accioly, pela 28ª rodada do Campeonato Brasileiro.
+ Veja a tabela do Brasileirão
O técnico Umberto Louzer poderá contar com o volante Roni, que não enfrentou o Corinthians por questões contratuais – ele pertence ao time paulista e está emprestado ao Atlético-GO. Por outro lado, o costarriquenho Joel Campbell recebeu o terceiro cartão amarelo e está suspenso.
Resta saber se o goleiro Ronaldo terá condições de jogo. Ele foi vetado da última partida porque sentiu um desconforto muscular antes do embarque para o duelo contra o Corinthians. Pedro Rangel foi o titular.
O Atlético-GO é o lanterna do Campeonato Brasileiro, com apenas 18 pontos, e está próximo do rebaixamento. O Dragão tem 10 pontos a menos que o Vitória, primeiro time fora do Z-4. O Fluminense, próximo adversário, também faz campanha ruim e está em 18ª, com 27 pontos."
Jorginho passa por cirurgia e desfalca o Atlético-GO por até dois meses,Meia volta a sentir o tendão de Aquiles e é afastado dos gramados; diretoria vê jogador com bons olhos para o ano que vem,Redação do ge,"O meia Jorginho voltou a sentir uma lesão no tendão de Aquiles e vai desfalcar o Atlético-GO pelo período de seis a oito semanas. Ele passou por uma cirurgia na última segunda-feira.
+ Veja a tabela da Série A
Jorginho sofreu a lesão ainda quando jogava no CRB, seu último clube antes do retorno ao Dragão. O meia participou de três jogos no Campeonato Brasileiro, incluindo as vitórias sobre Internacional e Juventude.
Jorginho tem 33 anos e está em sua quinta passagem pelo Atlético-GO. Apesar da lesão, a diretoria rubro-negra vê o jogador com bons olhos para a Série B do ano que vem. O contrato dele com o clube é até o fim de 2025.
O Dragão é o lanterna do Campeonato Brasileiro, com 18 pontos, e tem poucas chances de escapar do rebaixamento."
"Alix fala sobre lesão e ainda vê chance do Atlético-GO escapar do rebaixamento: ""Nada perdido""","Apesar de situação quase irreversível, zagueiro ainda crê em permanência do Dragão na Série A",Redação do ge,"A situação é complicada, quase que irreversível. Na lanterna isolada do Brasileirão, o Atlético-GO caminha a passos largo para o rebaixamento. Com apenas 18 pontos em 27 jogos, o Dragão teria que ganhar pelo menos nove dos 11 jogos restantes para ainda sonhar com a permanência.
Mas apesar da dificuldade, o zagueiro Alix Vinícius diz que ainda acredita em uma reviravolta. O jogador afirma que somente enquanto houve possibilidades, o time vai lutar para seguir na Série A no ano que vem.
- Não tem nada perdido, (o campeonato) só acaba dia 8 de dezembro. Então, daqui até lá, vamos jogar e vamos vencer que é o mais importante para retomar nossa confiança dentro do campeonato - afirmou.
Alix também comentou sobre a lesão muscular que o tirou de oito jogos do Atlético-GO. Ele retonrou há duas rodadas: primeiro vindo do banco, contra o Vitória, e depois começando como titular, diante do Corinthians.
- Toda lesão para o jogador é difícil, estar de fora. Tive uma lesão no joelho e estava sentindo muita dor. Junto com o departamento médico, preferi esperar um pouco, tratar, para poder voltar 100% e ajudar meus companheiros - lembra."
STJD suspende Guilherme Romão e Emiliano Rodríguez por 90 dias após confusão em jogo do Atlético-GO contra o Bahia,"Os dois jogadores foram acusados de agredir o árbitro da partida; também julgado, Alix foi absolvido. Dragão vai recorrer",Redação do ge,"Lanterna isoldo da Campeonato Brasileiro e muito perto do rebaixamento, o Atlético-GO sofreu outro duro golpe para o restante da temporada. O Superior Tribunal de Justiça Desportiva (STJD) suspendeu o lateral Guilherme Romão e o atacante Emiliano Rodríguez por 90 dias. Ambos foram punidos em virtude da confusão no jogo do Atlético-GO contra o Bahia, no último dia 24 de julho. A acusação é que eles tentaram agredir o árbitro da partida (vídeo acima).
O julgamento ocorreu na tarde desa sexta-feira. O zagueiro Alix, foi absolvido das acusações. Já o Bahia foi multado em R$ 1 mil por atraso de um minuto do retorno do intervalo.
O Atlético-GO informou que vai recorrer da decisão.
O julgamento tomou por base a súmula do jogo, válido pela 19ª rodada. O Atlético-GO vencia o confronto por 1 a 0 até os 53 minutos, quando o Bahia empatou, dando origem a uma grande confusão em campo.
Os jogadores do Dragão se revoltaram com os acréscimos e partiram para cima do abritro Luciano da Silva Moreira, que relatou em súmula os problemas ocorridos em campo.
Sobre Romão, o ábritrou afirmou o seguinte: “Após revisão, expulsei por cartão vermelho direto, por conduta violenta, ao dar[1]me um empurrão pelas costas com brutalidade e força excessiva quando a partida já havia sido finalizada. Devido ao tumulto generalizado não foi possível apresentar o cartão vermelho no campo de jogo”.
Já em relação a Emiliano, o relato foi parecido: ""Após revisão, expulsei por cartão vermelho direto, por conduta violenta, ao puxar minha camisa com brutalidade e força excessiva quando a partida já havia sido finalizada. Devido ao tumulto generalizado não foi possível apresentar o cartão vermelho no campo de jogo”.
Alix também foi denunciado após ser expulso por, segundo o árbitro, ""retirar sua camisa, retardando o reinicio de jogo, causando retardo em sua saída de campo”. No entanto, ele não foi punido.
O advogado do Atlético-GO no julgamento, Filipe Oliveira, pediu a absolvição dos três atletas, mas a relatora do processo, auditora Ana Luiz Ralil, discorou. Segundo ela, ""no vídeo foi muito claro a puxada da camisa pelos atletas"".
Os auditores Delmiro Campos, José Luiz, Pedro Perdiz e o presidente Ticiano Figueiredo acompanharam na íntegra a fundamentação"
Escalação do Atlético-GO: time terá três mudanças contra o Corinthians,"Alix Vinicius, Gonzalo Freitas e Jan Hurtado são as novidades do Dragão para jogo deste sábado",Redação do ge,"Lanterna do Campeonato Brasileiro, o Atlético-GO volta a campo neste sábado, às 16h, contra o Corinthians, e o técnico Umberto Louzer fará três mudanças no time. O jogo da 27ª rodada da Série A será na Neo Química Arena, em São Paulo.
+ Veja a tabela da Série A
A primeira mudança está na zaga: Alix Vinicius entra no lugar de Philipe Sampaio. No meio-campo, Gonzalo Freitas retorna de suspensão na vaga de Shaylon. No ataque, o venezuelano Jan Hurtado entrará no lugar de Derek.
O Dragão será escalado com Ronaldo; Bruno Tubarão, Alix Vinicius, Adriano Martins e Guilherme Romão; Gonzalo Freitas, Rhaldney e Campbell; Alejo Cruz, Jan Hurtado e Luiz Fernando.
O Atlético-GO está na última colocação do Campeonato Brasileiro, com 18 pontos, e tem nove pontos a menos que o Fluminense, primeiro time fora da zona de rebaixamento. Já o Corinthians, com 25 pontos, está em 18º, dentro do Z-4."
Atlético-GO pode ter o terceiro goleiro do elenco em campo contra o Fluminense,Ronaldo foi vetado do último jogo e Pedro Rangel não pode enfrentar o Tricolor Carioca por força de contrato; Emerson Júnior pode estrear,Redação do ge,"O Atlético-GO volta a jogar no próximo domingo, em casa, contra o Fluminense, e pode ter em campo Emerson Júnior, o terceiro goleiro do elenco. Pedro Rangel, que foi titular diante do Corinthians na última rodada do Brasileirão, está fora por força de contrato – ele pertence ao Fluminense e está emprestado ao Dragão.
+ Veja a tabela do Brasileirão
Ronaldo, principal goleiro do elenco rubro-negro, foi vetado antes do embarque para enfrentar o Corinthians por conta de um desconforto muscular. A tendência é que ele entre em campo no próximo domingo, porém, se o goleiro for vetado novamente o titular será Emerson Júnior.
Atlético-GO e Fluminense se enfrentam domingo, às 16h, no Antônio Accioly. Emerson Júnior, de 24 anos, chegou ao time goiano emprestado pelo Inter e ainda não teve a oportunidade de entrar em campo.
Quando Ronaldo não esteve disponível, o escolhido foi Pedro Rangel, que já disputou oito partidas na temporada. No último sábado, Emerson Júnior ficou no banco contra o Corinthians."
Atlético-GO embarca para enfrentar o Criciúma; Ronaldo está fora,Goleiro está suspenso pelo terceiro cartão amarelo e será substituído por Pedro Rangel; time pode ter mais mudanças,Redação do ge,"O Atlético-GO volta a campo na próxima quinta-feira, fora de casa, contra o Criciúma, pela 29ª rodada do Campeonato Brasileiro, e o técnico Umberto Louzer fará mudanças em relação ao time que bateu o Fluminense no último domingo.
+ Veja a tabela da Série A
A principal ausência é o goleiro Ronaldo, suspenso pelo terceiro cartão amarelo. Pedro Rangel, que não pôde enfrentar o Fluminense por força de contrato, será o titular do Dragão.
Quem também pode voltar é o atacante Joel Campbell, que cumpriu suspensão na última rodada, assim como Luiz Fernando, recuperado de um desgaste muscular. Nesta terça-feira, Luiz Fernando treinou entre os reservas, mas poderá ser escalado contra o Criciúma.
Na lateral-esquerda, o titular continua sendo Alejo Cruz, já que Guilherme Romão está suspenso pelo STJD – a diretoria rubro-negra vai recorrer da pena.
A provável escalação do Atlético-GO tem Pedro Rangel; Bruno Tubarão, Alix Vinicius e Alejo Cruz; Roni, Rhaldney e Baralhas; Lacava (Campbell), Hurtado e Janderson (Luiz Fernando).
O Dragão é o lanterna do Campeonato Brasileiro, com 21 pontos, mas se aproximou de todos os concorrentes na luta contra o rebaixamento. Se vencer o Criciúma, o time goiano pode ultrapassar o Cuiabá e deixar a última colocação."
"Louzer celebra vitória do Atlético-GO e evita falar de arbitragem: ""Não entro nessa seara""","Treinador cita ""merecimento"" em triunfo do Dragão e se esquiva sobre lance polêmico que deu os três pontos ao Rubro-negro sobre o Fluminense",Redação do ge,"O técnico Umberto Louzer elogiou o comportamento dos seus jogadores na vitória do Atlético-GO por 1 a 0 sobre o Fluminense, pela 28ª rodada do Brasileirão. O Dragão voltou a ganhar depois de três derrotas seguidas na competição.
Na visão do treinador, o Dragão fez uma bnoa partida e foi coroada com o resultado positivo dentro de casa.
- Foi a vitória do merecimento. Merecemos por tudo aquilo que apresentamos na somatória geral do jogo. No primeiro tempo, poderíamos ter saído em vantagem. Segundo tempo deu uma equilibrada, mas em momento algum a equipe deixou de acreditar na possibilidade de vitória - elogiou.
Louzer foi questionado sobre os lances polêmicos da partida. Um gol de Alix, ainda no primeiro tempo, foi anulado por impedimento após análise do VAR. Já na segunda etapa, o tento de Janderson - que decretou a vitória - só foi validado também após intervenção do árbitro de vídeo. Inicialmente, o juiz Ramon Abatti Abel entendeu que a bola saiu pela linha de fundo.
O lance motivou várias reclamações dos jogadores do Fluminense. Mas o técnico fugiu das polêmicas e evitou falar sobre o trabalho da arbitragem.
- Eu não falo (sobre arbitragem). Se puxar meu histórico, eu nunca vou transferir uma responsabilidade minha. Deixo para as pessoas responsáveis para sempre falar sobre a questão de arbitragem. Essa é a minha conduta, minha linha. Não entro nessa seara - justificou.
O Atlético-GO volta a campo na próxima quinta-feira, contra o Criciúma, fora de casa."
"Escalação do Atlético-GO: Ronaldo volta, mas lateral é problema contra o Fluminense","Goleiro está recuperado de um desconforto muscular; em contrapartida, Guilherme Romão é suspenso de última hora",Redação do ge,"O técnico Umberto Louzer ganhou um problema de última hora para escalar o Atlético-GO no próximo domingo, às 16h, no Antônio Accioly. O Dragão recebe o Fluminense, pela 28ª rodada do Campeonato Brasileiro. O treinador rubro-negro não conta com o lateral-esquerdo Guilherme Romão, suspenso pelo STJD.
+ Veja a tabela da Série A
Sendo assim, o uruguaio Alejo Cruz terá que ser deslocado para a lateral, e a tendência é que Janderson entre no time titular. O goleiro Ronaldo, que não enfrentou o Corinthians devido a um desconforto muscular, treina normalmente e vai para o jogo.
A provável escalação rubro-negra tem Ronaldo; Bruno Tubarão, Alix Vinicius, Adriano Martins e Alejo Cruz; Roni, Baralhas e Rhaldney; Janderson, Hurtado e Luiz Fernando.
Atlético-GO e Fluminense estão na zona de rebaixamento. O Dragão é o lanterna, com 18 pontos, e tem poucas chances de escapar da Série B do ano que vem. Já o adversário está em 18º, com 27 pontos."
Polêmica dos bolos: Atlético-GO volta atrás e diz que não irá processar confeiteiras,"Após repercussão negativa, Dragão afirma que fiscalização vale para pirataria em grande escala",Nathália Freitas,"Nos últimos dias, o Atlético-GO se viu em meio a uma polêmica envolvendo bolos, confeiteiras e direitos sobre sua marca. É que uma empresa especializada no combate à pirataria, contratada pelo clube, acionou as artesãs alegando que elas não podem usar o escudo do Dragão em bolos de aniversário e outras festas temáticas (saiba mais no vídeo abaixo).
Algumas, inclusive, foram notificadas judicialmente, sob pena de multa e outras sanções, como foi o caso de Fabiana Oliveira, que fez um bolo em 2022 com alusão ao Atlético-GO e recebeu uma cobrança de R$ 1,5 mil.
- É um sentimento de revolta. Ter que correr atrás para não ter que pagar ou entrar com advogado. Se defender de uma coisa tão simples, como um topo de bolo. Eu não tenho condições de pagar essa dívida. Foi um valor tão simbólico. Eu não dei prejuízo algum ao time - alega Fabiana.
Diante da repercussão negativa, Adson Batista foi questionado sobre o assunto e se mostrou contrário à postura adotada pela empresa. Segundo dirigente do Atlético-GO, ele já determinou, assim que tomou conhecimento da situação, que essas cobranças parem se ser feitas.
- Isso é um absurdo. Já falei com os responsáveis e isso não vai mais acontecer. Nós temos é que valorizar quem ama o nosso clube.
- Você acha que eu quero prejudicar gente que faz bolo de aniversário? Isso não existe. Todos que foram ao Atlético-GO, tiveram o caso resolvido. A determinação é essa: se tem alguém prejudicado com esse perfil, vai no Atlético-GO que será resolvido - completou Adson.
Procurado pelo Globo Esporte, o Atlético-GO também emitiu uma nota oficial sobra o assunto. Leia na íntegra:
O Atlético Clube Goianiense solicitou a No Fake o ajuste imediato dos filtros, para que a Inteligência Artificial deixe de fazer notificações a pequenos empreendedores e torcedores que usem o escudo e as alcunhas do clube. O foco do Atlético é para o uso indevido de grandes empresas e falsificações em grande escala.
O Atlético está resolvendo caso a caso para que desbloqueie todas as empresas e doceiras que tiveram suas páginas bloqueadas. Esta não é e nunca foi a intenção do clube!
O clube reitera que essa situação foi causada por mal uso da plataforma pela empresa No Fake. O Atlético não tem a intenção de restringir o uso de sua marca por quaisquer torcedores
Solicitamos, inclusive, para que os torcedores e profissionais que fizerem bolos e festas de aniversários temáticas do Dragão, que nos marque nas redes sociais para que possamos divulgar em todas as nossas plataformas.
Por fim, em qualquer caso de notificação ou página bloqueada, o torcedor ou profissional pode entrar em contato diretamente com o clube, em seu canal de atendimento, pelo (62) 3210 3233."
Atlético-GO decide rescindir contrato com atacante Emiliano Rodríguez,"Jogador uruguaio de 21 anos começou bem a temporada, mas não joga mais pelo Dragão",Redação do ge,"Titular em boa parte da temporada, o atacante Emiliano Rodríguez, de 21 anos, não joga mais pelo Atlético-GO. A diretoria rubro-negra vai rescindir o contrato do jogador, que estava emprestado pelo Boston River, do Uruguai, até o fim do ano.
O ge apurou que “problemas internos” motivaram a decisão do clube.
+ Veja a tabela do Brasileirão
Emiliano Rodríguez disputou 36 jogos pelo Dragão e marcou oito gols, sendo quatro no Campeonato Goiano e quatro na Copa do Brasil. No Brasileirão, ele passou em branco.
Na última sexta-feira, o atacante acabou suspenso pelo Superior Tribunal de Justiça Desportiva (STJD) pela confusão após o jogo contra o Bahia, na 19ª rodada do Campeonato Brasileiro – o lateral Guilherme Romão também foi suspenso.
O Atlético-GO irá recorrer da pena, no entanto, Emiliano Rodríguez não joga mais pelo Dragão, que volta a campo na próxima quinta-feira, fora de casa, contra o Criciúma, pela 29ª rodada."
Atlético-GO se aproxima de todos os concorrentes na luta contra o rebaixamento,"Dragão segue na lanterna, mas conta com derrotas dos clubes que estão mais próximos na tabela",Redação do ge,"Depois de vencer o Fluminense, o Atlético-GO chegou aos 21 pontos e se aproximou de todos os concorrentes na luta contra o rebaixamento. Um deles é o próprio Fluminense, que ficou estacionado nos 27 pontos.
+ Veja a tabela da Série A
O Dragão segue na lanterna, mas se aproximou ainda do Cuiabá (23 pontos), Corinthians (28 pontos), Vitória (28 pontos), Athletico-PR (31 pontos) e Criciúma (32 pontos). Todos estes clubes perderam na 28ª rodada do Campeonato Brasileiro.
O Vitória é o primeiro time fora da zona de rebaixamento e tem sete pontos a mais que o Atlético-GO. O Dragão voltará a campo já na próxima quinta, fora de casa, contra o Criciúma. Se vencer, o time rubro-negro pode ultrapassar o Cuiabá e deixar a lanterna.
Depois da partida contra o Criciúma, o técnico Umberto Louzer terá um bom tempo para trabalhar o time, já que o Brasileirão será paralisado por conta da Data Fifa. O jogo seguinte do Atlético-GO será contra o Cuiabá, em casa, marcado para o fim de semana do dia 20 de outubro."
Roni vê motivação extra com possibilidade de o Atlético-GO sair da lanterna,"Após vencer o Fluminense, Dragão visita o Criciúma e pode ultrapassar o Cuiabá em caso de mais uma vitória",Redação do ge,"O Atlético-GO finalizou nesta quarta-feira, em Florianópolis, a preparação para o jogo desta quinta, em Criciúma, contra o Criciúma, pela 29ª rodada do Campeonato Brasileiro. O Dragão pode sair da lanterna caso conquiste a vitória seguida – o Cuiabá, que recebe o São Paulo no sábado, tem dois pontos a mais,
+ Veja a tabela da Série A
Uma das armas do técnico Umberto Louzer é o volante Roni. Ele afirma que a possibilidade de ganhar uma posição na tabela é uma motivação a mais e afirma que ainda acredita na fuga do rebaixamento.
- É importante vencer novamente. Depois de uma vitória em cima do Fluminense, uma grande equipe, temos essa possibilidade (deixar a lanterna). Isso nos dá esperança e faz a gente olhar para o futuro de uma maneira melhor. Vai ser um grande jogo, uma decisão para nós. Já estamos trabalhando e estudando o adversário para buscar a vitória e tentar sair dessa situação.
-Como jogador, eu acredito muito. Parece impossível, mas eu, como jogador, acredito muito (na fuga do rebaixamento) – completou Roni.
O Atlético-GO tem 21 pontos e está na última posição do Campeonato Brasileiro. Na última rodada, o time goiano reduziu a diferença para os principais concorrentes. Um deles foi o próprio Criciúma, que perdeu para o Bahia e ficou com 32 pontos. Roni espera um jogo bastante complicado na casa do adversário.
- A gente sabe que o Criciúma é um time muito “encardido”, difícil de jogar contra e que não vai dar espaço para nós. Vai ser um grande duelo, um grande jogo e sabemos que vai ser difícil. Mas nossa mentalidade é vencer.
Criciúma e Atlético-GO se enfrentam nesta quinta, às 19h, no estádio Heriberto Hülse. O técnico Umberto Louzer não conta com o goleiro Ronaldo, suspenso.
A provável escalação rubro-negra tem Pedro Rangel; Bruno Tubarão, Alix Vinicius, Adriano Martins e Alejo Cruz; Roni, Rhaldney e Baralhas; Campbell (Lacava), Hurtado e Janderson (Luiz Fernando)."
