title,subtitle,author,article_content
David rompe ligamento cruzado do joelho e não joga mais pelo Vasco em 2024,"Prazo de recuperação é de oito a 10 meses, mesmo tempo que Jair e Paulinho foram desfalques em 2024",Bruno Murito,"David não joga mais pelo Vasco em 2024. O atacante rompeu o ligamento cruzado do joelho esquerdo na partida contra o Cruzeiro, neste domingo, e será desfalque para o elenco vascaíno durante todo o restante da temporada e uma boa parte de 2025.


A informação do ge foi confirmada pelo Vasco, que em postagem nas redes sociais no início da tarde desta segunda-feira divulgou que David sofreu uma entorse no joelho esquerdo e rompeu o ligamento cruzado. Ele passará por cirurgia nos próximos dias.
O atacante David saiu de campo logo aos nove minutos de jogo contra o Cruzeiro no Mineirão. O jogador sentiu dores no joelho esquerdo em lance com Mateus Vital e ficou muito abalado ainda em campo. Com as mãos no rosto, o atleta vascaíno foi levado primeiro ao banco de reservas.
Dois membros do estafe do clube de São Januário o apoiaram para o jogador não colocar a perna esquerda no campo. Depois, ele subiu na maca e foi levado ao vestiário.
O jogador de 28 anos tem 39 partidas na temporada, com sete gols e quatro assistências - ele foi titular desde o início do ano no Vasco e é um dos três jogadores com mais participações em gols em 2024.
+ ✅Clique aqui para seguir o novo canal ge Vasco no WhatsApp
+ Leia mais notícias do Vasco
David se torna mais uma baixa para o ataque do Vasco, que também já havia perdido Adson para o restante da temporada, por uma fratura na tíbia que demandou cirurgia do atacante.


Assista tudo sobre o Vasco no ge, na Globo e no SporTV:"
"Vegetti chama a responsabilidade do Vasco para a Copa do Brasil: ""Estamos perto de um título""","Artilheiro da competição, argentino foi decisivo em todas as fases até aqui e é postulante a ídolo",Bruno Murito,"O empate domingo com o Cruzeiro em 1 a 1 no Mineirão já é passado. O foco do Vasco, a partir desta segunda-feira, é totalmente na Copa do Brasil. O clube carioca seguirá em Belo Horizonte para enfrentar o Atlético-MG, na quarta-feira, às 19h15, na Arena MRV. A partida marca o início da disputa das semifinais da competição.
+ David rompe ligamento cruzado do joelho e não joga mais em 2024
Capitão do time e artilheiro da Copa do Brasil, Vegetti chamou a atenção do clube para a responsabilidade que é estar entre os quatro melhores do país na competição. O atacante argentino disse que o Vasco tem uma oportunidade única pela frente e que é preciso jogar com inteligência.
— Sabemos que a Copa do Brasil é diferente, é mata-mata, são dois jogos. Temos que ser inteligentes, tem que preparar a cabeça. Eles (Atlético-MG) são um time que fica muito com a bola, já sofremos quando jogamos aqui no Brasileiro. Mas acho que evoluímos muito, temos que fazer o que estamos fazendo. Confiamos no trabalho e no nosso grupo, estamos com muita expectativa nessa Copa do Brasil.
+ ✅Clique aqui para seguir o novo canal ge Vasco no WhatsApp
+ Leia mais notícias do Vasco
Desde que chegou ao Vasco, Vegetti se tornou o cara do time e é um postulante a ídolo do clube. Um título da Copa do Brasil pode aumentar ainda mais a relevância dele na história recente vascaína, na qual ele já foi decisivo desde a salvação na luta contra o rebaixamento em 2023.
Em 2024, o atacante é o destaque da Copa do Brasil. Em oito jogos, são seis gols, que o deixam como artilheiro geral da competição. Vegetti também foi decisivo nas três disputas de pênaltis até aqui, contra Água Santa, Fortaleza e Athletico, quando converteu as últimas cobranças de cada uma.
Com o gol no domingo, ele entrou para o top-5 de maiores artilheiros estrangeiros do Vasco. São 29 gols, mesmo número anotado por Alfredo González (Argentina) e Bahianinho (Portugal). Veja o ranking abaixo:


Além das penalidades, Vegetti tem sido extremamente letal pelo ar. O atacante fez gols decisivos com origem em cruzamentos contra Marcílio Dias, Água Santa Fortaleza, Atlético-GO e Athletico-PR — ou seja, em todas as fases da Copa do Brasil até aqui.
— A gente trabalha para que o time ganhe, eles sabem bem quais são as minhas qualidades. A gente tenta de tudo, de muitas maneiras diferentes chegar no gol. Contra o Cruzeiro foi no oportunismo, de estar atento na jogada. A gente está entrosando com os companheiros que chegaram na janela, trabalhando para que os gols cheguem de maneiras diferentes. O mais difícil no futebol é fazer gol, tem que ficar ligado e aproveitar as oportunidades que o time cria.
Na atual temporada, Vegetti se tornou capitão do Vasco e tem conquistado ainda mais identificação com a torcida. Ele chamou a atenção para a importância do Vasco voltar às semifinais da Copa do Brasil depois de 13 anos.
— Acho que é um momento muito importante para nós. Mais do que para nós, para o clube, mas para a torcida. Há muito tempo que o Vasco não joga a semifinal dessa competição. A gente sabe da importância e da responsabilidade que tem essa camisa. A gente sabe que são dois jogos, vai ser um jogo muito difícil na quarta-feira — disse o argentino.
Sobre a alteração das datas dos jogos de volta da Copa do Brasil, Vegetti também se posicionou. O atacante disse que faltou a CBF ser mais justa com o Vasco na organização das datas, uma vez que o Atlético-MG teve o pedido de trocas nas datas atendido.
— Recebemos essa notícia à noite, acho que tem ser um pouco mais justo na hora de tomar decisões. Que os dois times estejam de acordo, e não só um. Mas acontece, acho que nosso presidente se posicionou bem, ele trabalha para o melhor pelo Vasco. Temos que pensar no jogo.
O Vasco enfrenta o Atlético-MG na Arena MRV na quarta-feira, às 19h15. O jogo é válido pela partida de ida das semifinais da Copa do Brasil. O clube carioca tenta repetir o feito de 2011, última vez em que chegou aos quatro melhores da competição, quando eliminou o Avaí e chegou à final do torneio, o qual se sagrou campeão contra o Coritiba.


Assista tudo sobre o Vasco no ge, na Globo e no SporTV:"
Vasco tentou negociar aumento de carga com o Atlético-MG; venda abre com ingresso a R$ 325,Torcida do Vasco terá direito a 2 mil ingressos para jogo de quarta-feira; veja como comprar,Bruno Murito,"O Vasco tentou negociar com o Atlético-MG um aumento da carga de ingressos para o jogo desta quarta-feira, pela ida das semifinais da Copa do Brasil, mas não obteve sucesso. As vendas para a torcida visitante abrem às 10h (de Brasília) desta segunda-feira com a entrada a R$ 325 (valor inteiro).
Paralelamente à indefinição das datas e à polêmica envolvendo as mudanças definidas pela CBF, em que Vasco e Corinthians sentiram-se prejudicados, a diretoria cruz-maltina conversava com o Atlético-MG na tentativa de conseguir mais ingressos para sua torcida na Arena MRV.
No entanto, o Vasco foi informado que, por questões de segurança, apenas 5% dos ingressos poderiam ser destinados para os visitantes. Isso significa que os vascaínos terão direito a aproximadamente 2 mil ingressos para o jogo de quarta-feira.
Na volta, em São Januário, a tendência é que o mesmo aconteça para a torcida do Atlético-MG. Os mesmos 5% da capacidade total devem ser reservados para os torcedores atleticanos: cerca de 1 mil bilhetes, portanto.
Depois de tanto aguardar, a torcida do Vasco poderá adquirir seu ingressos nesta segunda, dois dias antes da partida. Para isso, terá que desembolsar R$ 325 (valor inteiro) ou R$ 162,50 (meia). Os valores são determinados pelo clube mandante da partida.


A venda dos ingressos será destinada aos Sócios do Vasco de forma on-line nos formatos INTEIRA e MEIA (a quem tem direito, sendo obrigatória a comprovação), tendo como benefício apenas a PRIORIDADE NA COMPRA, sendo necessária a troca do voucher pelo ingresso físico em um dos pontos de troca indicado.
Dos valores por setor (INTEIRA):
SETOR VISITANTE (VASCO) – R$325,00
Da abertura e encerramento das vendas:


Onde comprar:


A venda on-line para a torcida Visitante é limitada a um ingresso por cadastro e os ingressos do tipo “Meia-entrada” estão limitados à 40% das respectivas cargas.
Data e horário das ondas de compra:


+ ✅Clique aqui para seguir o novo canal ge Vasco no WhatsApp
+ Leia mais notícias do Vasco


Assista tudo sobre o Vasco no ge, na Globo e no SporTV:"
"Rafael Paiva valoriza ponto conquistado pelo Vasco: ""Não deixa de ser um bom resultado""","Treinador diz que ia substituir Mateus Carvalho momentos antes da expulsão e explica que mexeu no time já pensando no jogo contra o Atlético-MG, na quarta-feira; veja a coletiva",Bruno Murito,"Depois do empate em 1 a 1 com Cruzeiro, no Mineirão, o técnico Rafael Paiva disse que o ponto conquistado pelo Vasco precisa ser valorizado. A equipe abriu o placar com Vegetti no jogo válido pela 28ª rodada do Brasileirão, sofreu o gol de empate, teve Mateus Carvalho expulso e conseguiu segurar o resultado fora de casa.
+ Atuações do Vasco: Mateus Carvalho e Emerson Rodríguez são os piores
- Acho que o que fica de saldo foi que a gente continua evoluindo, no nosso ponto de vista. Conseguimos entrar bem no jogo, fomos extremamente competitivos no primeiro tempo, tentamos pressionar o Cruzeiro o tempo todo, conseguimos jogar boa parte do primeiro tempo. Conseguimos fazer um gol com algumas oportunidades, com transições de contra-ataques. Podíamos buscar o segundo gol. Esse é o saldo que fica, estamos evoluindo, crescendo, com possibilidade de buscar a vitória o tempo todo - disse o comandante.
- Depois do gol e da expulsão, o jogo mudou bastante. A gente sofreu, ficou em bloco mais baixo, sofreu cruzamentos. No final das contas, a gente sabe como é difícil jogar aqui. Viemos para ganhar, mas pontuar não deixa de ser um bom resultado para nós - completou.
Mateus Carvalho recebeu o cartão vermelho direto no início do segundo tempo, depois de cometer falta em cima de Matheus Henrique. Paiva explicou na coletiva que, momentos antes, planejou substituí-lo. E também disse que tirou Hugo Moura já pensando no jogo contra o Atlético-MG, pela semifinal da Copa do Brasil, que ocorre na próxima quarta-feira.
- A respeito do Cocão, a gente ia colocar o Victor Luís e Leandro. Foi bem na nossa frente. Ele sentiu cãibra. Faz alguns jogos que não fazia 90 minutos. Nos fez dar um passo atrás para a gente perceber se ia aguentar mesmo ou não porque era nosso último ato, não poderíamos mais trocar ninguém. Optamos por segurar e na sequência foi expulso - explicou o treinador, antes de prosseguir:
- Em relação ao Sforza e PH, eram trocas que a gente ia fazer. O Coutinho, a gente tem que ter muita paciência para não queimar etapas. A gente precisa ter o Coutinho sempre. A gente vai regular a minutagem para termos o Coutinho sempre. Não adianta manter 90 minutos, ele está voltando agora, o primeiro jogo como titular. A gente tem que ter paciência até conseguir deixá-lo 90 minutos. O Hugo era importante para o jogo contra o Atlético, a gente precisa ter saúde para jogar contra o Atlético, a gente precisa dar ritmo para outros jogadores, foi muito em cima disso.
O empate do Vasco também foi marcado por uma notícia preocupante: David sofreu lesão no joelho no primeiro tempo e deixou o campo com muitas dores. Paiva disse que o atacante ainda vai passar por exames.
- O David vai fazer exame amanhã e vamos ter clareza. Inchou um pouco o joelho mas não adianta falarmos sem ter exame. É um jogador importantíssimo, tem regularidade muito alta, com muita participação em gol. A gente espera que não seja nada grave, mas amanhã teremos respostas - concluiu.


Payet no banco
- Sobre quem vai entrar contra o Atlético, a gente vai estudar mais. O Coutinho estava apto, era importante iniciar. O Payet era possibilidade de troca mas o jogo caminhou para outras situações. Importante é ter jogadores com ritmo, o Payet estava jogando, se a gente precisar dele, vai estar pronto para ajudar.
Disputa interna
- A gente precisa manter viva sempre a disputa interna, isso faz a gente crescer. Também tínhamos que pensar no próximo jogo, também vamos ter o Juventude no sábado. Quanto mais jogadores com ritmo de jogo e num nível próximo, isso vai ajudar a gente na reta final. Quem entrou, foi muito bom. A gente começa a ter mais dúvidas positivas de quem vai entrar. É mérito do que a gente está fazendo. O caminho é esse e a gente precisa manter a regularidade do jogo.
Mudanças no time
- O Puma estava entrando muito bem. Fez gol contra o Athletico-PR, deu assistência contra o Flamengo, foi convocado para a seleção Uruguaia, está num momento bem, a gente precisa aproveitar. Hoje, entrou na lateral. PH também está muito bem. É uma dobra que a gente fez com Piton, Victor Luis e Leandrinho e a gente sabe que pode fazer do outro lado também. A gente ganha mais uma opção para iniciar ou no decorrer do jogo. Importante é que os jogadores estão se sentindo confortáveis.
Datas da Copa do Brasil
- Sobre as mudanças de datas, Pedrinho e Marcelo já posicionaram o que o Vasco pensa. A gente sofreu contra o Athletico-PR a convocação do Puma e do Menezes. Um chegou na noite da véspera, outro, no dia do jogo. A gente achou que a Justiça seria manter a data. A gente sofreu com isso e seria mais justo manter. Houve as mudanças e a gente se sentiu prejudicado. É importante colocar o que o Vasco pensa. Na parte tática, a gente precisa estar pronto, não pode tirar a concentração. Nossas estratégias tem de ser coerentes.
Atuação de Emerson Rodríguez
- A gente tem que ter paciência com Emerson para adaptação, vem de outra competição. Tanto o campeonato mexicano como americano. Ele toma boas decisões, outras não tão boas. Faz parte do processo. Ele tem potencial, tem crescido, entendido o Vasco. Ele vai nos ajudar muito, vai evoluir mais, é aberto para interpretar melhor o jogo e está no caminho para desenvolver e terminar bem a temporada.
Retorno do Jair
- A gente está feliz com o retorno do Jair. É muito querido pelo grupo, tem uma qualidade imensa, vai agregar muito. A gente também precisa de paciência, está voltando, precisa de confiança nas ações. Já está treinando com grupo, treinou um período com volume mais baixo, vamos tentar não pular etapas. Vai ganhando ritmo de treino, vai agregar muito, só precisamos pensar quando vai ser. A gente não pode colocá-lo numa dificuldade como estão sendo os jogos agora. É um grupo que tem contribuído muito no processo e o Jair está ajudando muito quanto ao Atlético-MG.
+ ✅Clique aqui para seguir o novo canal ge Vasco no WhatsApp
+ Leia mais notícias do Vasco


Assista tudo sobre o Vasco no ge, na Globo e no SporTV:"
Por que Paulinho acertou com o Atlético-MG e não voltou para o Vasco? Veja bastidores da época,"Identificado com o clube de São Januário, atacante já se declarou vascaíno nesta temporada",Bruno Murito,"A partida entre Atlético-MG e Vasco, nesta quarta-feira, às 19h15, na Arena MRV, marca o reencontro de Paulinho com o clube que o revelou para o futebol. O atacante já enfrentou o time de São Januário outras vezes, mas nunca em uma partida de tanta relevância como a das semifinais da Copa do Brasil.
+ ✅Clique aqui para seguir o novo canal ge Vasco no WhatsApp
Paulinho se declarou vascaíno em várias oportunidades — a mais recente em julho, no anúncio do retorno de Philippe Coutinho. Antes de acertar com o Atlético-MG, em dezembro de 2022, o atacante se ofereceu para retornar ao clube que o revelou.
No entanto, a negociação não aconteceu. Por quê? A dúvida ainda paira na cabeça de muitas pessoas que vivem no dia a dia do Vasco e de muitos torcedores do clube. O que poucas pessoas sabem é que Paulinho se ofereceu para retornar a São Januário, em duas oportunidades, no meio do ano de 2022 e no fim. Mas o nome não foi aprovado pelo financeiro da 777 e da SAF.
+ Leia mais notícias do Vasco
Em mais de uma oportunidade, Paulo Bracks, gestor do Vasco na época, disse que os valores eram altíssimos, mas após a saída dele, disse que o atacante que estava no Bayer Leverkusen valia o investimento.
— Tema polêmico, e mais um em que apanhei sem me defender, para preservar as partes envolvidas. Eu procurei o empresário do jogador quando estávamos na Série B. O interesse era dos dois lados, sim, mas os números não eram altos, eram impossíveis para o orçamento do clube. E essa negativa não foi minha. Foi de quem tinha a caneta e o controle do financeiro. E não estou dizendo que não valia. Valia, e como valia, mas não tinha autorização para fazer. Ponto — disse Bracks, em entrevista ao ge em 2023.
A declaração dá a entender que Paulo Bracks faria o investimento, mas não teve autorização para que isso acontecesse. E foi isso que aconteceu, segundo apuração do ge. Os valores não foram aprovados por Luiz Mello, ex-CEO do Vasco, e pelo comitê da 777 Partners, antiga sócia-majoritária.
Do outro lado, o ge ouviu de pessoas ligadas à gestão da SAF na época que o comitê da 777 achava que Paulinho comprometeria boa parte do orçamento. Na ocasião, o clube tinha outras prioridades no mercado, como reformular todo o elenco na volta à Série A.
Procurado pelo ge, Luiz Mello negou que tenha vetado a contratação de Paulinho e ressaltou que o departamento de futebol era responsável pela montagem do elenco. Mello reforçou que não chegou a desaprovar qualquer negociação com Paulinho, uma vez que nehuma proposta formal foi realizada pelo atacante.
+ Vasco rebate Flamengo sobre alteração das datas da Copa do Brasil: ""Boa fé: você tem ou não""


Paulinho tinha o interesse de voltar ao Brasil e deu prioridade, desde o primeiro momento, ao Vasco. Inclusive, comunicou a alguns funcionários a vontade dele, ainda quando o clube estava na Série B. Sem acordo, o atacante fechou com o Atlético-MG em dezembro de 2022.
+ Escalação do Vasco: time tem dúvida no ataque para enfrentar o Atlético-MG
Após uma temporada de 2023 fantástica pelo Atlético-MG, Paulinho não fechou as portas para um possível retorno ao Vasco no futuro. Em entrevista ao canal “Pai da Batida”, durante um torneio de futevôlei, no fim do ano passado, o jogador disse que gostaria de voltar ao clube algum dia, mas ressaltou que seu projeto, no momento, é o Atlético-MG.
— Com certeza. É o clube que me criou, me mostrou para o mundo... Claro que, se um dia for possível voltar, ficaria muito feliz em voltar para casa. A gente nunca sabe o que vai acontecer no futuro. Meu foco hoje é ajudar o Galo a estar nas cabeças do futebol brasileiro - disse Paulinho, ao canal.
Paulinho, de 23 anos, foi vendido pelo Vasco ao Bayer Leverkusen em 2018 por cerca de R$ 80 milhões, após 35 jogos, sete gols e quatro assistências. No ano passado, pelo Atlético-MG, o atacante foi artilheiro do Brasileirão com 20 gols.
Paulinho já enfrentou o Vasco em três oportunidades, duas no Brasileirão do ano passado e uma nesta edição da competição. São duas vitórias vascaínas e uma do Atlético-MG. Ele nunca marcou contra o clube que o revelou.


Assista tudo sobre o Vasco no ge, na Globo e no SporTV:"
"Vice do Vasco explica ação no STJD contra troca de datas da Copa do Brasil: ""Essa mudança é ilegal""","Em participação no programa ""Seleção sportv"", Paulo Salomão critica medida da CBF",Redação do ge,"Em participação no programa ""Seleção sportv"" nesta terça-feira, o vice-presidente do Vasco, Paulo Salomão, explicou a ação no Superior Tribunal de Justiça Desportiva (STJD) contra as trocas das datas dos jogos de volta da semifinal da Copa do Brasil. O clube acionou o tribunal na segunda.
- O Vasco recebeu a notícia com bastante surpresa e indignação. Apesar de a CBF ter mandado um ofício ao Vasco indagando sobre essa possibilidade, o Vasco de maneira incisiva e imediatamente entendia que essa medida seria muito ruim, não só para o Vasco, mas para a competição, para o calendário e para o futebol brasileiro. O Vasco não quer ser beneficiado, mas também não quer ser prejudicado. A justificativa (da mudança) seria porque a partida era muito próxima da Data Fifa e, nas quartas de final, o Vasco se deparou como uma situação idêntica. Dois dos nossos atletas foram convocados, um para a seleção uruguaia e um para a seleção chilena, tiveram que fazer uma logística, voar de madrugada para que pudessem estar presentes no jogo contra o Athletico em Curitiba.
- Ingressamos na justiça desportiva acreditando que essa mudança não deveria ocorrer, uma vez que o calendário já havia sido divulgado. Essas datas estavam disponibilizadas desde o começo do ano. No sorteio da Copa do Brasil as datas estavam estabelecidas. Não houve nenhuma mudança por parte da Conmebol que justificasse essa alteração. Razão pela qual a gente não só protestou na CBF, como também buscou as instâncias da justiça desportiva, que são os caminhos adequados e legais para que pudéssemos defender os interesses do Vasco e também da profissionalização do futebol.
Veja o posicionamento completo de Paulo Salomão no vídeo no início da matéria.
Salomão informou que o Vasco tem uma reunião agendada na CBF para discutir esse tema e entender as razões que fizeram a entidade alterar as datas.
O Vasco espera conseguir a anulação no STJD, mesmo sabendo que é um terreno de dura disputa contra a CBF, que tem natural influência sobre as comissões e indicações no tribunal. Mas também conta na estratégia jurídica com Paulo Salomão, ex-presidente do STJD.
- Os argumentos são vários: a prévia divulgação desse calendário, a violação ao estatuto do torcedor que impede essa mudança de data. Não obstante o argumento apresentado pela CBF é que a mudança seria em razão da melhora do espetáculo, a gente entende que essa mudança é ilegal. E o Regulamento Geral de Competições estabelece que a modificação de data só poderia ocorrer em razão de solicitação do mandante e não do visitante, como aconteceu no caso concreto. Dentre outros argumentos jurídicos que constam na peça apresentada pelo Vasco no STJD - completou Salomão.
O clube entende que ""Atlético-MG e Flamengo estão sendo beneficiados"" e não descarta ir à Justiça comum. A proposta havia partido de um pedido do Galo, que provavelmente terá jogadores convocados na Data Fifa, sendo que o Vasco já havia recusado a solicitação formal da entidade para mudar o dia do segundo jogo da semifinal.


2 de outubro




19 de outubro


20 de outubro

"
"Vasco recupera moral de zagueiros do elenco e tem disputa aberta entre João Victor, Léo e Maicon","Com rodízio, jogadores têm atuações regulares e passam confiança antes de decisão",Bruno Murito,"Maicon e Léo, João Victor e Maicon ou João Victor e Léo: qual a dupla de zaga titular do Vasco? Esta é a pergunta que o torcedor, com base nos últimos jogos, não sabe responder.
Contra o Cruzeiro, no domingo, Rafael Paiva escalou João Victor e Léo, uma dupla que pouco jogou junta sob o comando do treinador no Vasco. Por lesões e suspensões, João Victor alternou a titularidade com Léo, enquanto Maicon teve mais sequência no time. A nova dupla, no entanto, foi elogiada pelo técnico.
— Mais uma vez nossa dupla de defesa foi muito boa. Ela fez um bom jogo. Algum tempo atrás, os nossos defensores foram muito criticados. De alguns jogos para cá, conseguimos ter uma regularidade muito alta. Isso demonstra como temos evoluído como equipe, como colocamos mais jogadores na mesma posição com condições de fazer grandes jogos.
+ Vasco deve ir ao STJD contra troca de datas da Copa do Brasil e não descarta acionar Justiça comum
Antes da partida contra o Cruzeiro, João Victor e Léo só atuaram juntos na atual passagem de Rafael Paiva na partida contra o Criciúma, que terminou empatada em 2 a 2, pelo segundo turno.
A resposta para a titularidade na defesa pode vir até de acordo com o adversário. A comissão técnica do Vasco tinha preocupação com o ataque do Cruzeiro para a partida, formado por um trio mais móvel, com Kaio Jorge, Lautaro Díaz e Gabriel Verón. A escolha dos zagueiros passou pela forma que o time carioca avaliou como ideal para enfrentar o adversário.
— Nós pressionamos o Cruzeiro alto o tempo todo. O Lautaro é um jogador muito difícil de marcar, muito rápido. Saímos com os dois amarelados (João Victor e Léo), mas acho que eles fizeram um grande jogo. Eles vão deixando dúvidas positivas na nossa cabeça. Quem vai começar o próximo jogo, se vamos mudar ou manter a dupla. Temos conseguido fazer o grupo crescer — disse Paiva.
+ ✅Clique aqui para seguir o novo canal ge Vasco no WhatsApp
+ Leia mais notícias do Vasco
A velocidade da dupla foi testada durante a partida em diversos momentos. Em dois contra-ataques do Cruzeiro, João Victor arrancou muito antes dos atacantes rivais e chegou na frente para afastar o perigo. Assista aos lances no topo da matéria.
Contra o Palmeiras, o Vasco foi mais exigido pelo alto, e Maicon e Léo foram titulares, com João Victor como opção no banco de reservas.
Para o jogo contra o Atlético-MG, João Victor volta de suspensão na Copa do Brasil. Ele ficou de fora da partida de volta contra o Athletico-PR, pelas quartas de final, porque foi expulso na ida ao se envolver em uma discussão com o atacante rival Di Yorio.


Assista tudo sobre o Vasco no ge, na Globo e no SporTV:"
